,q,choices,a,qtype
1340,Who will win the election for New Mexico's 2nd Congressional District in 2020?,"['The Democratic Party candidate', 'The Republican Party candidate', 'Someone else']",B,mc
1341,Which presidential candidate will win Texas?,"['The Democratic Party candidate', 'The Republican Party candidate', 'Someone else']",B,mc
1342,Who will win the U.S. Senate election for Iowa in 2020?,"['The Democratic Party candidate', 'The Republican Party candidate', 'Someone else']",B,mc
1343,Will a World Series decide an MLB Champion in 2020?,"['yes', 'no']",yes,t/f
1344,In how many states will Kanye West appear on the ballot for the 2020 presidential election?,"['8 or fewer', 'Between 9 and 16', 'Between 17 and 24', 'More than 24']",B,mc
1345,When will Microsoft announce a deal for its acquisition of TikTok in the U.S.?,"['Before 16 September 2020', 'Between 16 September 2020 and 31 October 2020', 'Not before 1 November 2020']",C,mc
1346,How many presidential candidate debates between the Democratic and Republican nominees will take place before the 2020 general election?,"['0', '1', '2', '3 or more']",C,mc
1347,Which U.S. presidential candidate will have raised the most campaign money as of 30 September 2020?,"['Joe Biden (D)', 'Donald Trump (R)', 'Someone else']",A,mc
1348,How many MLB players will have a regular season batting average of .400 or higher in 2020?,"['0', '1', '2', '3', '4 or more']",A,mc
1349,Who will win the election for Oklahoma's 5th Congressional District in 2020?,"['The Democratic Party candidate', 'The Republican Party candidate', 'Someone else']",B,mc
1350,Who will win the election for Illinois' 13th Congressional District in 2020?,"['The Democratic Party candidate', 'The Republican Party candidate', 'Someone else']",B,mc
1351,Who will win the election for New York's 11th Congressional District in 2020?,"['The Democratic Party candidate', 'The Republican Party candidate', 'Someone else']",B,mc
1352,Who will win the election for Texas' 24th Congressional District in 2020?,"['The Democratic Party candidate', 'The Republican Party candidate', 'Someone else']",B,mc
1353,"Before 11 November 2020, will Alexander Lukashenko cease to be the president of Belarus?","['yes', 'no']",no,t/f
1354,"Before 14 February 2021, will former King Juan Carlos I and/or former Catalan President Carles Puigdemont return to Spain?","['Yes, only Juan Carlos I', 'Yes, only Carles Puigdemont', 'Yes, both', 'No']",D,mc
1355,"When will SpaceX's satellite internet service, Starlink, begin offering commercial service in North America?","['Before 1 January 2021', 'Between 1 January 2021 and 31 March 2021', 'Between 1 April 2021 and 30 June 2021', 'Not before 1 July 2021']",D,mc
1356,"At close of business on 31 December 2020, will Apple be the most valuable publicly traded company in the world?","['Yes, the most valuable in the world', 'No, but the most valuable in the United States', 'No']",A,mc
1357,"Before 14 November 2020, will there be a lethal confrontation in Lebanon or Israel between the armed forces of Hezbollah and those of Israel?","['yes', 'no']",no,t/f
1358,Will California voters approve Proposition 22 (App-Based Drivers as Contractors and Labor Policies Initiative)?,"['yes', 'no']",yes,t/f
1359,Will California voters approve Proposition 16 (Repeal Proposition 209 Affirmative Action Amendment)?,"['yes', 'no']",no,t/f
1360,Will Colorado voters approve Proposition 113 (Colorado National Popular Vote Interstate Compact Referendum)?,"['yes', 'no']",yes,t/f
1361,How many U.S. states will have a 1.0 or greater effective reproduction number (Rt) for COVID-19 as of 11 January 2021?,"['7 or fewer', 'Between 8 and 12', 'Between 13 and 17', 'Between 18 and 22', '23 or more']",E,mc
1362,Which team will win the 2020 NBA Finals?,"['Boston Celtics', 'Denver Nuggets', 'Houston Rockets', 'Indiana Pacers', 'Los Angeles Clippers', 'Los Angeles Lakers', 'Milwaukee Bucks', 'Toronto Raptors', 'Another team', 'There will be no 2020 NBA Finals winner']",F,mc
1363,Who will win the 2020 NBA Most Valuable Player Award?,"['Giannis Antetokounmpo, Milwaukee Bucks', 'James Harden, Houston Rockets', 'LeBron James, Los Angeles Lakers']",A,mc
1364,Who will win the 2020 NBA Rookie of the Year Award?,"['Ja Morant, Memphis Grizzlies', 'Kendrick Nunn, Miami Heat', 'Zion Williamson, New Orleans Pelicans']",A,mc
1365,Who will win the U.S. Senate election for South Carolina in 2020?,"['The Democratic Party candidate', 'The Republican Party candidate', 'Someone else']",B,mc
1366,Who will win the election for South Carolina's 1st Congressional District in 2020?,"['The Democratic Party candidate', 'The Republican Party candidate', 'Someone else']",B,mc
1367,Who will win the U.S. Senate election for Kansas in 2020?,"['The Democratic Party candidate', 'The Republican Party candidate', 'Someone else']",B,mc
1368,Who will win the election for Minnesota's 7th Congressional District in 2020?,"['The Democratic Party candidate', 'The Republican Party candidate', 'Someone else']",B,mc
1369,Who will win the U.S. Senate election for Georgia (Class II seat) in 2020?,"['The Democratic Party candidate', 'The Republican Party candidate', 'Someone else']",A,mc
1370,When will opposition leader Svetlana Tikhanovskaya return to Belarus?,"['Before 4 September 2020', 'Between 4 September and 16 October 2020', 'Not before 17 October 2020']",C,mc
1371,When will the EU amend its Own Resources Decision to help finance the EU's proposed COVID-19 recovery package?,"['Before 1 October 2020', 'Between 1 October 2020 and 31 December 2020', 'Between 1 January 2021 and 31 March 2021', 'Not before 1 April 2021']",D,mc
1372,How many Arab League member states other than Palestine will diplomatically recognize the State of Israel as of 28 August 2021?,"['2 or fewer', '3', '4', '5', '6 or more']",E,mc
1373,"Before 1 January 2022, will the United States Olympic Committee announce that it is boycotting the 2022 Winter Olympics?","['yes', 'no']",no,t/f
1374,"Before 3 November 2020, will federal legislation to provide at least $5 billion in new direct financial assistance to the United States Postal Service (USPS) become law?","['yes', 'no']",no,t/f
1375,What will be Airbnb's end-of-day market capitalization on its first day of public trading?,"['Less than $15 billion', 'Between $15 billion and $25 billion, inclusive', 'More than $25 billion but less than $35 billion', '$35 billion or more', 'Airbnb will not trade publicly before 4 December 2020']",E,mc
1376,"Before 15 November 2020, who will be elected to be the next leader of Japan's Liberal Democratic Party (LDP)?","['Taro Aso', 'Shigeru Ishiba', 'Fumio Kishida', 'Taro Kono', 'Yoshihide Suga', 'Someone else']",E,mc
1377,"Before 22 September 2020, will federal legislation to provide at least $100 billion in direct financial assistance to state and/or local governments become law?","['yes', 'no']",no,t/f
1378,"What will be the closing price per barrel for West Texas Intermediate (WTI) crude oil on 22 September 2020, according to Bloomberg?","['Less than $25.00', 'Between $25.00 and $35.00, inclusive', 'More than $35.00 but less than $45.00', 'Between $45.00 and $55.00, inclusive', 'More than $55.00']",C,mc
1379,What will be the closing value of the S&P 500 Index on 22 September 2020 relative to its closing value on 28 August 2020?,"['Down more than 12.0%', 'Down between 4.0% and 12.0%, inclusive', 'Between down less than 4.0% and up less than 4.0%', 'Up between 4.0% and 12.0%, inclusive', 'Up more than 12.0%']",B,mc
1380,What will be the closing yield for the 30-year U.S. Treasury on 22 September 2020?,"['Less than 1.200%', 'Between 1.200% and 1.400%, inclusive', 'More than 1.400% but less than 1.600%', 'Between 1.600% and 1.800%, inclusive', 'More than 1.800%']",C,mc
1381,What will be the closing price of Tesla stock on 22 September 2020?,"['Less than $400.00', 'Between $400.00 and $450.00, inclusive', 'More than $450.00 but less than $500.00', 'Between $500.00 and $550.00, inclusive', 'More than $550.00']",B,mc
1382,"In California v. Texas, will the Supreme Court rule that reducing the penalty amount for the individual mandate of the Affordable Care Act (ACA) to zero rendered the individual mandate provision unconstitutional?","['yes', 'no']",no,t/f
1383,"In Google v. Oracle America, will the Supreme Court rule that the Copyright Act protects the Oracle computer source code that Google copied for its Android operating system?","['yes', 'no']",no,t/f
1384,When will the Transportation Security Administration (TSA) next screen two million or more travelers in a single day?,"['Before 1 January 2021', 'Between 1 January 2021 and 31 March 2021', 'Between 1 April 2021 and 30 June 2021', 'Between 1 July 2021 and 30 September 2021', 'Not before 1 October 2021']",C,mc
1385,"How many active California fires with 10,000 or more acres burned will be reported by the LA Times' California Fire Map as of 1 October 2020?","['0', '1', '2', '3', '4 or more']",E,mc
1386,Will there be a complex coordinated terrorist attack (CCTA) in the United States either directed or inspired by a foreign terrorist organization before 1 September 2021?,"['yes', 'no']",no,t/f
1387,Will there be a complex coordinated terrorist attack (CCTA) in the United States before 1 September 2021?,"['yes', 'no']",no,t/f
1388,Will any 2020 California election results be altered by a cyberattack against a voting system?,"['yes', 'no']",no,t/f
1389,"Between 15 September 2020 and 30 November 2020, will a country cease to formally recognize Taiwan?","['yes', 'no']",no,t/f
1390,"Before 1 December 2020, will Mohammed bin Salman cease to be the Crown Prince of Saudi Arabia?","['Yes, by becoming the King of Saudi Arabia', 'Yes, without becoming the King of Saudi Arabia', 'No']",C,mc
1391,Which NFL team will win the NFC West division in the 2020 season?,"['Arizona Cardinals', 'Los Angeles Rams', 'San Francisco 49ers', 'Seattle Seahawks', 'Another outcome']",D,mc
1392,Which NFL team will win the NFC South division in the 2020 season?,"['Atlanta Falcons', 'Carolina Panthers', 'New Orleans Saints', 'Tampa Bay Buccaneers', 'Another outcome']",C,mc
1393,"Before 1 January 2021, will Alassane Ouattara cease to be the president of Ivory Coast?","['yes', 'no']",no,t/f
1394,"When will 25,000 or more fans next attend a Premier League match?","['Before 19 October 2020', 'Between 19 October 2020 and 31 December 2020', 'Between 1 January 2021 and 15 March 2021', 'Between 16 March 2021 and 23 May 2021', 'Not before 24 May 2021']",E,mc
1395,"Before 18 September 2021, will Boris Johnson cease to be prime minister of the United Kingdom?","['yes', 'no']",no,t/f
1396,Which country will the 2020-21 UEFA Champions League final winner be from?,"['England', 'France', 'Germany', 'Italy', 'Spain', 'Another country', 'There will not be a 2020-21 final winner']",A,mc
1397,"At close of business on 27 January 2021, will the upper limit of the Federal Reserve's target range for the federal funds rate be lower, the same, or higher than it was at close of business on 16 December 2020?","['Lower', 'Same', 'Higher']",B,mc
1398,Will Recep Tayyip Erdoğan cease to be president of Turkey before 15 July 2021?,"['yes', 'no']",no,t/f
1399,"In its 2020 referendum, will Puerto Rico vote to become a state?","['yes', 'no']",yes,t/f
1400,Will the UN Security Council or UN General Assembly vote on a resolution concerning outer space before 1 May 2021?,"['Yes, and China will vote for it', 'Yes, and China will abstain or be absent from voting', 'Yes, and China will vote against it', 'No']",A,mc
1401,"Before 1 March 2021, will there be a lethal confrontation at sea between the forces of India and the People's Republic of China?","['yes', 'no']",no,t/f
1402,"In Fulton v. City of Philadelphia (City), will the Supreme Court rule that the City's requirement that Catholic Social Services (CSS) not discriminate against same-sex couples as a condition for working with the City's foster children is unconstitutional?","['yes', 'no']",yes,t/f
1403,When will the U.S. Senate confirm Amy Coney Barrett to the Supreme Court?,"['Before 3 November 2020', 'Between 3 November 2020 and 4 January 2021', 'Not before 5 January 2021']",A,mc
1404,What will be the delinquency rate on commercial real estate loans (excluding farmland) in the United States in the second quarter of 2021?,"['Less than 2.00%', 'Between 2.00% and 4.00%, inclusive', 'More than 4.00% but less than 6.00%', 'Between 6.00% and 8.00%, inclusive', 'More than 8.00%']",A,mc
1405,What will be the annual rate of housing starts for April 2021?,"['Less than 1.0 million', 'Between 1.0 million and 1.2 million, inclusive', 'More than 1.2 million but less than 1.4 million', 'Between 1.4 million and 1.6 million, inclusive', 'More than 1.6 million']",D,mc
1406,"Before 5 January 2021, will Vice President Mike Pence cast a tie-breaking vote in the Senate confirming Amy Coney Barrett to the U.S. Supreme Court?","['yes', 'no']",no,t/f
1407,When will Lebanon's parliament give a vote of confidence to a new government?,"['Before 1 December 2020', 'Between 1 December 2020 and 31 January 2021', 'Between 1 February 2021 and 31 March 2021', 'Not before 1 April 2021']",D,mc
1408,How many total cases of COVID-19 will the Public Health Agency of Canada (PHAC) report for Canada as of 31 December 2020?,"['Fewer than 256,985', 'Between 256,985 and 342,646 cases, inclusive', 'More than 342,646 but fewer than 428,308 cases', '428,308 or more cases']",D,mc
1409,When will a commercial flight of a Boeing 737 MAX aircraft next take off in the United States?,"['Before 31 December 2020', 'Between 1 January 2021 and 31 March 2021', 'Not before 1 April 2021']",A,mc
1410,How many U.S. states will have a 1.0 or greater effective reproduction number (Rt) for COVID-19 as of 31 December 2020?,"['24 or fewer', 'Between 25 and 30', 'Between 31 and 36', 'Between 37 and 42', '43 or more']",C,mc
1411,Will there be a complex coordinated terrorist attack (CCTA) in the United States either directed or inspired by a foreign terrorist organization before 1 September 2021?,"['yes', 'no']",no,t/f
1412,Will there be a complex coordinated terrorist attack (CCTA) in the United States before 1 September 2021?,"['yes', 'no']",no,t/f
1413,Will any 2020 California election results be altered by a cyberattack against a voting system?,"['yes', 'no']",no,t/f
1414,"Between 15 September 2020 and 30 November 2020, will a country cease to formally recognize Taiwan?","['yes', 'no']",no,t/f
1415,"Before 1 December 2020, will Mohammed bin Salman cease to be the Crown Prince of Saudi Arabia?","['Yes, by becoming the King of Saudi Arabia', 'Yes, without becoming the King of Saudi Arabia', 'No']",C,mc
1416,Which NFL team will win the NFC West division in the 2020 season?,"['Arizona Cardinals', 'Los Angeles Rams', 'San Francisco 49ers', 'Seattle Seahawks', 'Another outcome']",D,mc
1417,Which NFL team will win the NFC South division in the 2020 season?,"['Atlanta Falcons', 'Carolina Panthers', 'New Orleans Saints', 'Tampa Bay Buccaneers', 'Another outcome']",C,mc
1418,"Before 1 January 2021, will Alassane Ouattara cease to be the president of Ivory Coast?","['yes', 'no']",no,t/f
1419,"When will 25,000 or more fans next attend a Premier League match?","['Before 19 October 2020', 'Between 19 October 2020 and 31 December 2020', 'Between 1 January 2021 and 15 March 2021', 'Between 16 March 2021 and 23 May 2021', 'Not before 24 May 2021']",E,mc
1420,"Before 18 September 2021, will Boris Johnson cease to be prime minister of the United Kingdom?","['yes', 'no']",no,t/f
1421,Which country will the 2020-21 UEFA Champions League final winner be from?,"['England', 'France', 'Germany', 'Italy', 'Spain', 'Another country', 'There will not be a 2020-21 final winner']",A,mc
1422,"At close of business on 27 January 2021, will the upper limit of the Federal Reserve's target range for the federal funds rate be lower, the same, or higher than it was at close of business on 16 December 2020?","['Lower', 'Same', 'Higher']",B,mc
1423,Will Recep Tayyip Erdoğan cease to be president of Turkey before 15 July 2021?,"['yes', 'no']",no,t/f
1424,"In its 2020 referendum, will Puerto Rico vote to become a state?","['yes', 'no']",yes,t/f
1425,Will the UN Security Council or UN General Assembly vote on a resolution concerning outer space before 1 May 2021?,"['Yes, and China will vote for it', 'Yes, and China will abstain or be absent from voting', 'Yes, and China will vote against it', 'No']",A,mc
1426,"Before 1 March 2021, will there be a lethal confrontation at sea between the forces of India and the People's Republic of China?","['yes', 'no']",no,t/f
1427,"In Fulton v. City of Philadelphia (City), will the Supreme Court rule that the City's requirement that Catholic Social Services (CSS) not discriminate against same-sex couples as a condition for working with the City's foster children is unconstitutional?","['yes', 'no']",yes,t/f
1428,When will the U.S. Senate confirm Amy Coney Barrett to the Supreme Court?,"['Before 3 November 2020', 'Between 3 November 2020 and 4 January 2021', 'Not before 5 January 2021']",A,mc
1429,What will be the delinquency rate on commercial real estate loans (excluding farmland) in the United States in the second quarter of 2021?,"['Less than 2.00%', 'Between 2.00% and 4.00%, inclusive', 'More than 4.00% but less than 6.00%', 'Between 6.00% and 8.00%, inclusive', 'More than 8.00%']",A,mc
1430,What will be the annual rate of housing starts for April 2021?,"['Less than 1.0 million', 'Between 1.0 million and 1.2 million, inclusive', 'More than 1.2 million but less than 1.4 million', 'Between 1.4 million and 1.6 million, inclusive', 'More than 1.6 million']",D,mc
1431,"Before 5 January 2021, will Vice President Mike Pence cast a tie-breaking vote in the Senate confirming Amy Coney Barrett to the U.S. Supreme Court?","['yes', 'no']",no,t/f
1432,When will Lebanon's parliament give a vote of confidence to a new government?,"['Before 1 December 2020', 'Between 1 December 2020 and 31 January 2021', 'Between 1 February 2021 and 31 March 2021', 'Not before 1 April 2021']",D,mc
1433,How many total cases of COVID-19 will the Public Health Agency of Canada (PHAC) report for Canada as of 31 December 2020?,"['Fewer than 256,985', 'Between 256,985 and 342,646 cases, inclusive', 'More than 342,646 but fewer than 428,308 cases', '428,308 or more cases']",D,mc
1434,When will a commercial flight of a Boeing 737 MAX aircraft next take off in the United States?,"['Before 31 December 2020', 'Between 1 January 2021 and 31 March 2021', 'Not before 1 April 2021']",A,mc
1435,How many U.S. states will have a 1.0 or greater effective reproduction number (Rt) for COVID-19 as of 31 December 2020?,"['24 or fewer', 'Between 25 and 30', 'Between 31 and 36', 'Between 37 and 42', '43 or more']",C,mc
1436,"When will the 7-day rolling average of confirmed cases of COVID-19 in New York City (NYC) next reach or exceed 1,500?","['Before 1 November 2020', 'Between 1 November 2020 and 30 November 2020', 'Between 1 December 2020 and 31 December 2020', 'Between 1 January 2021 and 31 January 2021', 'Not before 1 February 2021']",B,mc
1437,"For any seven consecutive day period between 9 October 2020 and 15 June 2021, will there be fewer than 50,000 combined total confirmed new cases of COVID-19 in the United States?","['yes', 'no']",no,t/f
1438,"For any seven consecutive day period between 9 October and 31 December 2020, will there be fewer than 2,000 deaths of COVID-19 in the Brazil?","['yes', 'no']",yes,t/f
1439,What will be the closing value of the NASDAQ Composite Index on 20 November 2020?,"['Less than 10,600.00', 'Between 10,600.00 and 11,400.00, inclusive', 'More than 11,400.00 but less than 12,200.00', 'Between 12,200.00 and 13,000.00, inclusive', 'More than 13,000.00']",C,mc
1440,"Before 21 January 2021, will the House of Representatives, pursuant to the 12th Amendment, vote to choose a president of the United States?","['yes', 'no']",no,t/f
1441,What will be the closing price of Tesla stock on 20 November 2020?,"['Less than $400.00', 'Between $400.00 and $440.00, inclusive', 'More than $440.00 but less than $480.00', 'Between $480.00 and $520.00, inclusive', 'More than $520.00']",D,mc
1442,What will be the closing value of the S&P 500 Index on 13 November 2020 relative to its closing value on 2 November 2020?,"['Lower by more than 12%', 'Lower by between 4% and 12%, inclusive', 'Between lower by less than 4% and higher by less than 4%', 'Higher by between 4% and 12%, inclusive', 'Higher by more than 12%']",D,mc
1443,What will be the price of Bitcoin on 20 November 2020?,"['Less than $9,600.00', 'Between $9,600.00 and $10,800.00, inclusive', 'More than $10,800.00 but less than $12,000.00', 'Between $12,000.00 and $13,200.00, inclusive', 'More than $13,200.00']",E,mc
1444,Which NFL team will win the AFC North division in the 2020 season?,"['Baltimore Ravens', 'Cincinnati Bengals', 'Cleveland Browns', 'Pittsburgh Steelers', 'Another outcome']",D,mc
1445,Who will win the U.S. Senate election for Mississippi in 2020?,"['The Democratic Party candidate', 'The Republican Party candidate', 'Someone else']",B,mc
1446,"Before 1 September 2021, will Egypt, Ethiopia, and Sudan sign an agreement governing the filling of the Grand Ethiopian Renaissance Dam (GERD) reservoir?","['yes', 'no']",no,t/f
1447,Will Boom Technology's XB-1 supersonic aircraft complete a successful test flight before 2022?,"['yes', 'no']",no,t/f
1448,When will Canada next permit discretionary travel for foreign nationals arriving from the United States?,"['Before 1 December 2020', 'Between 1 December 2020 and 31 January 2021', 'Between 1 February 2021 and 31 March 2021', 'Between 1 April 2021 and 31 May 2021', 'Not before 1 June 2021']",E,mc
1449,"Between 16 October 2020 and 31 December 2021, how many successful flight tests of the Common Hypersonic Glide Body (C-HGB) will the United States conduct?","['0', '1', '2', '3', '4 or more']",A,mc
1450,"How many countries will have 100,000 or more deaths attributed to COVID-19 as of 30 April 2021?","['3', '4', '5 or 6', '7 or 8', '9 or more']",D,mc
1451,Will Prayut Chan-o-cha cease to be the prime minister of Thailand before 23 April 2021?,"['yes', 'no']",no,t/f
1452,What will U.S. holiday season retail sales be for 2020 relative to the 2019 holiday season?,"['Lower by more than 2.5%', 'Lower by between 0.0% and 2.5%, inclusive', 'Higher by more than 0.0% but less than 2.5%', 'Higher by between 2.5% and 5.0%, inclusive', 'Higher by more than 5.0%']",D,mc
1453,"Before 1 January 2022, will Amazon announce that it will spin off Amazon Web Services (AWS)?","['yes', 'no']",no,t/f
1454,Will Apple's iPhone net sales be higher in FY 2021 than FY 2019?,"['yes', 'no']",yes,t/f
1455,"At close of business on 17 March 2021, will the upper limit of the Federal Reserve's target range for the federal funds rate be lower, the same, or higher than it was at close of business on 27 January 2021?","['Lower', 'Same', 'Higher']",B,mc
1456,"Before 1 May 2021, will Mahmoud Abbas cease to be president of the Palestinian Authority?","['yes', 'no']",no,t/f
1457,"Before 14 December 2020, will the U.S. Supreme Court hear oral arguments in a case related to any state's 2020 presidential election results?","['yes', 'no']",no,t/f
1458,"Before 1 January 2021, will the Council of the European Union decide to impose an arms embargo against Turkey?","['yes', 'no']",no,t/f
1459,Will North Korea launch an ICBM with a length of at least 20 meters before 1 December 2020?,"['yes', 'no']",no,t/f
1460,Will the Washington Football Team (fka Washington Redskins) win five or more regular season games in the 2020 NFL season?,"['yes', 'no']",yes,t/f
1461,"Between 9 November 2020 and 28 February 2021, will a country cease to formally recognize Taiwan?","['yes', 'no']",no,t/f
1462,Will the People's Republic of China (PRC) officially declare an air-defense identification zone (ADIZ) over any part of the South China Sea before 1 March 2021?,"['yes', 'no']",no,t/f
1463,Will Russia and the People's Republic of China (PRC) conduct any joint naval exercises before 1 March 2021?,"['yes', 'no']",yes,t/f
1464,When will the World Health Organization (WHO) report more than 35 million confirmed cases of COVID-19 for the Europe Region?,"['Before 1 January 2021', 'Between 1 January 2021 and 28 February 2021', 'Between 1 March 2021 and 30 April 2021', 'Between 1 May 2021 and 30 June 2021', 'Not before 1 July 2021']",B,mc
1465,When will the World Health Organization (WHO) report more than 20 million confirmed cases of COVID-19 for the South-East Asia Region?,"['Before 1 January 2021', 'Between 1 January 2021 and 28 February 2021', 'Between 1 March 2021 and 30 April 2021', 'Between 1 May 2021 and 30 June 2021', 'Not before 1 July 2021']",C,mc
1466,Will Nancy Pelosi be re-elected as Speaker of the House of Representatives in the 117th Congress?,"['yes', 'no']",yes,t/f
1467,Who will win Georgia's special election runoff for the U.S. Senate (Class III seat)?,"['Kelly Loeffler (R)', 'Raphael Warnock (D)']",B,mc
1468,"Between 13 November 2020 and 12 February 2021, will the closing price per barrel of WTI crude oil be higher than the closing price per barrel of Brent crude oil?","['yes', 'no']",no,t/f
1469,"Will the U.S. consume more energy from renewable sources in May 2021 than it did in May 2019, according to the U.S. Energy Information Administration (EIA)?","['yes', 'no']",yes,t/f
1470,"On 12 May 2021, will Ethiopia's Tigray region be under a federally-imposed state of emergency?","['yes', 'no']",no,t/f
1471,"In 2021, will total fire activity in the Amazon exceed the 2020 total count?","['yes', 'no']",no,t/f
1472,Will Nicolas Maduro cease to be president of Venezuela before 1 April 2021?,"['yes', 'no']",no,t/f
