,q,choices,a,qtype
4285,"What will the state-of-the-art language modelling performance on One Billion Word be on 2022-01-14, in perplexity amongst models not trained on additional data?","{'max': 21.8, 'min': 14, 'deriv_ratio': 1}",0.8012820512820512,num
4286,What will the value of the herein defined Image Classification Performance Index be on 2022-01-14?,"{'max': 140, 'min': 114.88, 'deriv_ratio': 1}",0.35156795382165623,num
4287,"How many e-prints on AI Safety, Interpretability or Explainability will be published on arXiv over the 2021-01-14 to 2022-01-14 period?","{'max': 1700, 'min': 150, 'deriv_ratio': 1}",0.2645161290322581,num
4288,"Before 2022, will Fluvoxamine receive authorization for treatment of Covid by the United States FDA before the end of the pandemic?","['yes', 'no']",no,t/f
4289,What will be the number of new incident U.S. adult and pediatric previous day admissions to the hospital with confirmed COVID-19 for the week beginning on 2021-01-24 and ending on 2021-01-30 (inclusive)?,"{'max': 250000, 'min': 0, 'deriv_ratio': 1}",0.329824,num
4290,What will be the total number of new incident deaths due to COVID-19 in the US for the week beginning on 2021-01-24 and ending on 2021-01-30 (inclusive)?,"{'max': 40000, 'min': 0, 'deriv_ratio': 1}",0.552325,num
4291,What will be the number of new incident confirmed positive COVID-19 cases in the US beginning on 2021-01-24 and ending on 2021-01-30 (inclusive)?,"{'max': 3400000, 'min': 0, 'deriv_ratio': 1}",0.31119676470588237,num
4292,What factor should the median 4-week-ahead COVIDhub Ensemble forecast of national incident deaths made on 4 Jan(a forecast for the 24-30 Jan week) be multiplied by so that it equals the reported number of new US incident deaths?,"{'max': 3, 'min': 0, 'deriv_ratio': 1}",0.4135,num
4293,What will be the cumulative number of deaths due to COVID-19 on 2021-12-31 if less than 50% of Americans initiate vaccination (1st dose received) with a COVID-19 vaccine by 2021-03-01?,"{'max': 1000000, 'min': 0, 'deriv_ratio': 1}",0.827869,num
4294,What will be the percent of B.1.1.7 among all S gene dropout SARS-CoV-2 samples submitted for genomic sequencing surveillance in the US between 2021-02-01 and 2021-02-15?,"{'max': 100, 'min': 0, 'deriv_ratio': 1}",0.485,num
4295,When will most people in England be legally able to meet socially in a group of six in public outdoor places?,"{'max': '2021-04-30', 'min': '2021-01-31', 'deriv_ratio': 1}",0.6455992509363296,num
4296,When will most people in England be legally able to meet socially in a group of six in private indoor places?,"{'max': '2021-07-31', 'min': '2021-02-28', 'deriv_ratio': 1}",0.5132171387073348,num
4297,When will government guidance allow indoor parties of any 100 people in England?,"{'max': '2021-10-01', 'min': '2021-03-01', 'deriv_ratio': 1}",0.6542056074766355,num
4298,Will President Trump be relieved of his duties under section four of the Twenty-fifth Amendment before inauguration day?,"['yes', 'no']",no,t/f
4299,What will Trump's approval rating be on 18-Jan-2021?,"{'max': 100, 'min': 0, 'deriv_ratio': 1}",0.38799999999999996,num
4300,"How many consecutive Presidents of the United States will there be, until that office remains vacant for a period of three consecutive months?",,,num
4301,Will Donald Trump cease to be President before  the 2021/01/20 inauguration?,"['yes', 'no']",no,t/f
4302,Will the USA enter a second civil war before 2031?,"['yes', 'no']",,t/f
4303,What will the state-of-the-art language modelling performance on WikiText-103 be at 2022-01-14 in perplexity amongst models not trained on additional data?,"{'max': 15.79, 'min': 8, 'deriv_ratio': 1}",0.8729139922978179,num
4304,What will the state-of-the-art performance on image classification on ImageNet be at 2022-01-14 in top-1 accuracy amongst models not trained on additional data?,"{'max': 95, 'min': 85.8, 'deriv_ratio': 1}",0.27173913043478254,num
4305,What will the highest Exact Match rate of the best-performing model on SQuAD2.0 be on 2022-01-14?,"{'max': 93.1, 'min': 90.724, 'deriv_ratio': 1}",0.0904882154882113,num
4306,How many e-prints on multi-modal learning will be published on ArXiv over the 2021-12-14 to 2022-01-14 period?,"{'max': 600, 'min': 60, 'deriv_ratio': 1}",0.34814814814814815,num
4307,Will Elon Musk have double the wealth of the second richest person by the end of 2022?,"['yes', 'no']",,t/f
4308,"What will the state-of-the-art performance on one-shot image classification on miniImageNet be, at 2022-01-14 in accuracy amongst models not trained on additional data?","{'max': 89, 'min': 82.92, 'deriv_ratio': 1}",0.3108552631578949,num
4309,"By By January 1st 2031, what will be the maximum compute (measured in petaFLOPS-days), used in training in an AI experiment?",,,num
4310,Will Brazil win the FIFA World Cup by the end of 2050?,"['yes', 'no']",,t/f
4311,When will 50% of the US population be vaccinated against Covid-19?,"{'max': '2022-06-30', 'min': '2021-01-20', 'deriv_ratio': 1}",0.3659695817490494,num
4312,When will 25% of the US population be vaccinated against Covid-19?,"{'max': '2022-06-30', 'min': '2021-01-20', 'deriv_ratio': 1}",0.16254752851711027,num
4313,"Will the UK have a 7 day rolling average above 2,000 covid deaths before June?","['yes', 'no']",no,t/f
4314,Will Donald Trump be outside of the United States on 2021-01-20?,"['yes', 'no']",no,t/f
4315,Will Washington D.C. become a state before 2025-01-20?,"['yes', 'no']",,t/f
4316,How many patients will the Shandong Yinfeng Life Science Research Institute report by 2026?,,,num
4317,Will federal criminal charges be levied against Donald Trump within a month of the end of his presidency?,"['yes', 'no']",no,t/f
4318,When will the next interstellar object be discovered?,,,num
4319,What will the state-of-the-art performance on semantic segmentation on Cityscapes be at 2022-01-14 in mean IoU in percent (MIoU%) amongst models not trained on additional data?,"{'max': 88, 'min': 83.3, 'deriv_ratio': 1}",0.23404255319149103,num
4320,What will the state-of-the-art performance on image classification on ImageNet be at 2026-12-14 in top-1 accuracy amongst models not trained on additional data?,,,num
4321,What will the state-of-the-art language modelling performance on WikiText-103 be at 2024-12-14 in perplexity amongst models not trained on additional data?,,,num
4322,"What will the highest score be, on Atari 2600 Montezuma's Revenge, by any ML model that is un-augmented with domain knowledge on 2022-01-14?","{'max': 1500000, 'min': 43791, 'deriv_ratio': 34.25361375625128}",0.0,num
4323,What will the value of the herein defined Object Detection  Performance Index be on 2022-01-14?,"{'max': 145, 'min': 116.88, 'deriv_ratio': 1}",0.3162066394025608,num
4324,What will the the sum of the level of performance (in exaFLOPS) of the all 500 supercomputers in the TOP500 be according to their November 2021 list?,"{'max': 7.5, 'min': 2.4, 'deriv_ratio': 1}",0.1254901960784314,num
4325,What share (in %) of the world's super-compute performance will be based in the United States in the November 2026 publication of TOP500 list?,,,num
4326,What will the the performance be of the top-performing supercomputer (in exaFLOPS) in the TOP500 be according to their June 2030 list?,,,num
4327,How much will the average degree of automation change for key US professions change from December 2020 to December 2026?,,,num
4328,How many people in the UK will have received a dose of a COVID-19 vaccine by 15th February?,"{'max': 25000000, 'min': 5000000, 'deriv_ratio': 1}",0.52880535,num
4329,When will 32 million people in the UK have received a dose of a COVID-19 vaccine?,"{'max': '2022-01-01', 'min': '2021-02-01', 'deriv_ratio': 1}",0.20238689288090486,num
4330,"What will the combined sector weighting of Information Technology and Communications be, in the S&P 500 on 2022-01-14?","{'max': 50, 'min': 30, 'deriv_ratio': 1}",0.4175000000000001,num
4331,When will the 7-day rolling average for US COVID-19 deaths drop below 500?,"{'max': '2021-12-28', 'min': '2021-01-12', 'deriv_ratio': 1}",0.36745833333333333,num
4332,Will there be major civil unrest or rioting in the US in before 1 March 2021?,"['yes', 'no']",no,t/f
4333,How many e-prints on Few-Shot Learning will be published on ArXiv over the 2021-01-14 to 2022-01-14 period?,"{'max': 2400, 'min': 400, 'deriv_ratio': 1}",0.6355,num
4334,How many Natural Language Processing e-prints will be published on arXiv over the 2021-01-14 to 2022-01-14 period?,"{'max': 17000, 'min': 3000, 'deriv_ratio': 1}",0.3618571428571429,num
4335,How many Reinforcement Learning e-prints will be published on arXiv over the 2021-01-14 to 2022-01-14 period?,"{'max': 6000, 'min': 2000, 'deriv_ratio': 1}",0.34375,num
4336,When there will be the first European trillion-dollar company?,,,num
4337,What will the value of the herein defined Object Detection  Performance Index be on 2026-12-14?,,,num
4338,"What will the price of IGM be, on 2030-12-13, in 2019 USD?",,,num
4339,"What will the median annual wage for Computer and Information Research Scientists be in the United states in 2029, in 2019 USD?",,,num
4340,When will there be a day on which no one in the UK dies with COVID-19?,,,num
4341,Will none of Trump's immediate family be indicted by 2022-01-01?,"['yes', 'no']",yes,t/f
4342,How much will the US market of plant-based meat grow in 2021 with respect to the previous year?,"{'max': 100, 'min': -50, 'deriv_ratio': 1}",0.3333333333333333,num
4343,"Will Joe Biden be officially inaugurated as President in-person outside the US capitol on January 20th, 2021?","['yes', 'no']",yes,t/f
4344,Will US poverty be higher in November 2021 than it was in November 2020?,"['yes', 'no']",no,t/f
4345,Will the US unemployment rate stay above 5% through November 2021?,"['yes', 'no']",no,t/f
4346,How many Computer Vision and Pattern Recognition e-prints will be published on arXiv over the 2021-01-14 to 2022-01-14 period?,"{'max': 26000, 'min': 9000, 'deriv_ratio': 1}",0.48523529411764704,num
4347,How many Natural Language Processing e-prints will be published on arXiv over the 2021-01-14 to 2030-01-14 period?,,,num
4348,How many Reinforcement Learning e-prints will be published on arXiv over the 2021-01-14 to 2027-01-01 period?,,,num
4349,What percent of total GDP will software and information services contribute to US GDP in Q3 of 2021?,"{'max': 4.4, 'min': 2.4, 'deriv_ratio': 1}",0.4089999999999999,num
4350,"What will the state-of-the-art performance on one-shot image classification on miniImageNet be, at 2024-12-14 in accuracy amongst models not trained on additional data?",,,num
4351,Will Trump be impeached and convicted by the Senate in 2021?,"['yes', 'no']",no,t/f
4352,"What will the Federal Reserves' Industrial Production Index be for January 2030, for semiconductors, printed circuit boards and related products?",,,num
4353,What percentage of the US 2024 presidential popular vote will the Democratic and Republican parties (combined) receive?,,,num
4354,Will a third-party or independent candidate win at least 5% of the popular vote in the 2024 US presidential election?,"['yes', 'no']",,t/f
4355,Will Median Bay Area House Prices decline by >= 5% in 2021?,"['yes', 'no']",no,t/f
4356,"How will the number of sexually transmitted infections diagnoses in England change from 2019 to 2020, in percent?","{'max': 40, 'min': -40, 'deriv_ratio': 1}",0.10074999999999998,num
4357,How many Executive Orders per week will President Biden issue?,,,num
4358,Will Kamala Harris be a candidate for President in the 2024 cycle?,"['yes', 'no']",,t/f
4359,"Will there be fewer than 6 conservative justices on the SCOTUS on January 20th, 2025?","['yes', 'no']",,t/f
4360,Will India's GDP grow in the first three quarters of 2021?,"['yes', 'no']",no,t/f
4361,"By 2022, will the US Senate confirm Biden's nominees for Treasury Secretary, Secretary of State, Defense Secretary, and Attorney General?","['yes', 'no']",yes,t/f
4362,Will there be a 7.0 or larger earthquake either somewhere under or within 81 Kilometres the Eastern Mediterranean Sea in 2021?,"['yes', 'no']",no,t/f
4363,What will USA's GDP/c growth rate be in 2020-2029?,,,num
4364,Will Trump gain at least 10M followers on another platform?,"['yes', 'no']",,t/f
4365,How many scheduled airline passengers in 2021 will verify their COVID-19 health statuses with CommonPass?,"{'max': 3000000000, 'min': 30000000, 'deriv_ratio': 100}",2.0,num
4366,When will the 7-day rolling average for US COVID-19 deaths drop below 100?,,,num
4367,"When, if ever, will people <18 years old vote in national elections in the US?",,,num
4368,"How many countries will allow people younger than 18 to vote, with no major conditions, in 2026?",,,num
4369,Will Donald J. Trump run for the office of President of the United States in 2024?,"['yes', 'no']",,t/f
4370,Will Mike Pence be a candidate for President in the 2024 cycle?,"['yes', 'no']",,t/f
4371,Will the Chancellor of Germany following the next election be from the CDU/CSU union?,"['yes', 'no']",no,t/f
4372,When will the second SpaceX Starship flight be?,"{'max': '2021-12-31', 'min': '2021-01-18', 'deriv_ratio': 1}",0.045799311559398016,num
4373,When will the third SpaceX Starship flight be?,"{'max': '2021-12-31', 'min': '2021-01-18', 'deriv_ratio': 1}",0.12964297150176113,num
4374,When will a SpaceX Starship reach orbit?,,,num
4375,"What will be the price of a Taco Bell Crunchwrap Supreme in Westfield, Indiana in 2025?",,,num
4376,"Will EA Global London 2021 be cancelled, rescheduled, or moved online again?","['yes', 'no']",no,t/f
4377,Will the Insurrection Act be invoked before 2025?,"['yes', 'no']",,t/f
4378,When will zettascale computing be achieved?,,,num
4379,Will AES-256 be publicly broken by 2040?,"['yes', 'no']",,t/f
4380,"Will Jair Bolsonaro be president of Brazil on January 2, 2023?","['yes', 'no']",,t/f
4381,How many emoji related court cases in 2021?,"{'max': 200, 'min': 0, 'deriv_ratio': 1}",0.83,num
4382,When will USA's GDP per capita (PPP) fall out of the world top 20?,,,num
4383,Will Bill Gates implant a brain-computer interface in anyone by 2030?,"['yes', 'no']",,t/f
4384,"Will the Riemann Hypothesis be proved true, if it is proved by 2100?","['yes', 'no']",,t/f
4385,Will the University of California Berkeley be primarily in-person for Fall 2021?,"['yes', 'no']",yes,t/f
4386,When will the UK hold its next general election?,,,num
4387,"Will Scotland hold an official, sanctioned referendum on independence before May 2024?","['yes', 'no']",,t/f
4388,Will UK festival Shambala take place in August 2021?,"['yes', 'no']",no,t/f
4389,"In the March 2021 Knesset election, will Likud win a plurality of seats?","['yes', 'no']",yes,t/f
4390,When will a song have been streamed 4 billion times on Spotify?,,,num
4391,What will the release date of the first song to be streamed 4 billion times on Spotify be?,,,num
4392,When will The Economist rank China as a democracy in the Democracy Index?,,,num
4393,Will there be a major nuclear accident before 2030?,"['yes', 'no']",,t/f
4394,Will the publicly-traded company GameStop (GME) reach a $420.69 stock price by the end of 2021?,"['yes', 'no']",yes,t/f
4395,Will the US rejoin the Iran Nuclear Deal before 2022?,"['yes', 'no']",no,t/f
4396,Will there be an episode of The Simpsons with an IMDb rating ≥ 8/10 before 2022?,"['yes', 'no']",yes,t/f
4397,How many doses of any COVID19 vaccine will have been administered in Germany on 2021-04-01?,"{'max': 200000000, 'min': 1000000, 'deriv_ratio': 1}",0.06613065326633166,num
4398,How many million doses of any COVID19 vaccine will have been administered in the EU on 2021-04-01?,"{'max': 445, 'min': 1, 'deriv_ratio': 1}",0.17033783783783782,num
4399,Will the Tampa Bay Buccaneers win Super Bowl LV?,"['yes', 'no']",yes,t/f
4400,"What will the total deal value be of all the US PE deals in billions of US$, in 2021?",,,num
4401,What will be the 4-week average of initial jobless claims filed in March 2021?,"{'max': 1000000, 'min': 700000, 'deriv_ratio': 1}",0.06333333333333334,num
4402,What will be the 5-week average of initial jobless claims filed in April 2021?,"{'max': 1000000, 'min': 600000, 'deriv_ratio': 1}",0.0695,num
4403,What will be the Industrial Production Index number for March 2021?,"{'max': 110, 'min': 100, 'deriv_ratio': 1}",0.5582999999999998,num
4404,What will be the Industrial Production Index number for April 2021?,"{'max': 110, 'min': 100, 'deriv_ratio': 1}",0.6,num
4405,What will be the seasonally adjusted CPI-U (less energy and food) for March 2021?,"{'max': 1.5, 'min': -1.5, 'deriv_ratio': 1}",0.6,num
4406,What will be the seasonally adjusted CPI-U (less energy and food) for April 2021?,"{'max': 1.5, 'min': -1.5, 'deriv_ratio': 1}",0.7999999999999999,num
4407,What will be the total stock of crude oil and other petroleum products for March 2021?,"{'max': 1500000, 'min': 1000000, 'deriv_ratio': 1}",0.57609,num
4408,What will be the total stock of crude oil and other petroleum products for April 2021?,"{'max': 1500000, 'min': 1000000, 'deriv_ratio': 1}",0.58,num
4409,"For the month of March 2021, what will the US Bureau of Labor Statistics report as the preliminary monthly nonfarm payroll number (in millions)?","{'max': 5, 'min': -5, 'deriv_ratio': 1}",0.5916,num
4410,"For the month of April 2021, what will the US Bureau of Labor Statistics report as the preliminary monthly nonfarm payroll number (in millions)?","{'max': 5, 'min': -5, 'deriv_ratio': 1}",0.5266,num
4411,When will WeRide begin testing their autonomous and fully driverless taxis in California?,"{'max': '2025-12-30', 'min': '2021-02-28', 'deriv_ratio': 1}",0.02463193657984145,num
4412,What will be the final asking price of Roblox stock at the end of its first trading day?,"{'max': 70, 'min': 30, 'deriv_ratio': 1}",0.98675,num
4413,When will Varda successfully manufacture and sell its first product from space?,,,num
4414,When will Australia reopen for quarantine-free international travel?,"{'max': '2024-01-01', 'min': '2021-02-15', 'deriv_ratio': 1}",0.35423478835978833,num
4415,"Will Rep Marjorie Taylor Greene (R, GA-14) be expelled or resign by 2022?","['yes', 'no']",no,t/f
4416,Will Matt Levine join substack before 2023?,"['yes', 'no']",,t/f
4417,Will Substack be valued over $1 Billion before 2024?,"['yes', 'no']",,t/f
4418,"Will any member of the Trump family join Substack by Nov 3, 2024?","['yes', 'no']",,t/f
4419,Will Substack cancel anyone before 2023?,"['yes', 'no']",,t/f
4420,"Will the subreddit /r/wallstreetbets be banned before Jan 1st, 2022?","['yes', 'no']",no,t/f
4421,Will GB News be broadcasting in 2025?,"['yes', 'no']",,t/f
4422,What will be the absolute efficacy of the single-dose Johnson & Johnson Ad26.COV2.S vaccine candidate according to the results of Phase III testing?,"{'max': 100, 'min': 0, 'deriv_ratio': 1}",0.546,num
4423,Will Silvio Berlusconi be elected to the Presidency of the Italian Republic in the next election?,"['yes', 'no']",no,t/f
4424,What will the US Q2 2021 GDP growth rate be according to the US Bureau of Economic Analysis Advance Estimate?,"{'max': 35, 'min': -35, 'deriv_ratio': 1}",0.5928571428571429,num
4425,"Will the United States Senate vote to expel a Senator before January 3, 2023?","['yes', 'no']",,t/f
4426,"What will be the total world military expenditure in 2021 (in billions USD), as reported by SIPRI?","{'max': 2500, 'min': 1500, 'deriv_ratio': 1}",0.5187,num
4427,When will the single-dose Johnson & Johnson SARS-CoV-2 vaccine be granted emergency use authorization by the US FDA?,"{'max': '2021-12-31', 'min': '2021-01-29', 'deriv_ratio': 1}",0.0863115906084656,num
4428,"By November 15, 2023, will President Biden officially declare his campaign for re-election?","['yes', 'no']",,t/f
4429,"What will the state-of-the-art object detection performance on COCO be, at 2021-06-14 in box Average Precision (box AP)?","{'max': 62, 'min': 57.3, 'deriv_ratio': 1}",0.29787234042553296,num
4430,"What will the state-of-the-art object detection performance on COCO be, at 2022-01-14 in box average precision (box AP)?","{'max': 65, 'min': 57.3, 'deriv_ratio': 1}",0.7792207792207789,num
4431,Will CD PROJEKT (WSE:CDR) reach its previous All Time High price of zł464.20 in 2021?,"['yes', 'no']",no,t/f
4432,Will an Australian Federal Election be held in 2021?,"['yes', 'no']",no,t/f
4433,Will at least 5 Republican Congresspeople join another party before 2022?,"['yes', 'no']",no,t/f
4434,When will at least two US states first disallow human-driven vehicles on public roads?,,,num
4435,When will any currency zone stop printing cash currency?,,,num
4436,What will be the 7-day rolling average for Covid-19 vaccines given on March 1st in the United States?,"{'max': 5000000, 'min': 0, 'deriv_ratio': 1}",0.3635004,num
4437,On what date will the number of people currently hospitalized in the US due to COVID-19 first fall below 30k?,"{'max': '2021-12-30', 'min': '2021-01-30', 'deriv_ratio': 1}",0.30077345309381237,num
4438,Will the EU have a mandatory multi-tiered animal welfare labelling scheme in place by 2025?,"['yes', 'no']",,t/f
4439,Will the EU phase out high-concentration CO2 stunning or killing of pigs by 2024?,"['yes', 'no']",,t/f
4440,When will most eggs produced in the EU be sexed before hatching?,,,num
4441,"In 2021 will the European Commission suspend all EU mink farming, including breeding, and all in-country and cross-border transportation of live mink and their raw pelts?","['yes', 'no']",no,t/f
4442,Will EU Member States or the Members of the European Parliament reject the ratification of EU-Mercosur agreement in 2021?,"['yes', 'no']",no,t/f
4443,When will the next Millennium Prize Problem be solved?,,,num
4444,Will the use of whips be banned on or before the 2026 Melbourne Cup thoroughbred horse race?,"['yes', 'no']",,t/f
4445,Will U.S. military troops still be in Afghanistan on 2021-05-01?,"['yes', 'no']",yes,t/f
4446,"In 2025, what percent of Australia's Liberal parliamentarians will be women?",,,num
4447,What will be the total number of new incident deaths due to COVID-19 in the US for the week beginning on 2021-02-21 and ending on 2021-02-27 (inclusive)?,"{'max': 30000, 'min': 0, 'deriv_ratio': 1}",0.4599666666666667,num
4448,What will be the total number of new incident U.S. adult and pediatric admissions to the hospital with confirmed COVID-19 for the week beginning on 2021-02-21 and ending on 2021-02-27 (inclusive)?,"{'max': 200000, 'min': 0, 'deriv_ratio': 1}",0.212655,num
4449,What will be the total number of new incident confirmed positive COVID-19 cases in the US beginning on 2021-02-21 and ending on 2021-02-27 (inclusive)?,"{'max': 3000000, 'min': 0, 'deriv_ratio': 1}",0.15968166666666667,num
4450,"Will GameStop (GME) reach a stock price of $1000 by 11:59 pm, 20 February 2021?","['yes', 'no']",no,t/f
4451,When will a SpaceX Starship upper stage successfully land?,"{'max': '2022-06-30', 'min': '2021-02-01', 'deriv_ratio': 1}",0.06006809338521401,num
4452,What will be the cumulative number of people who have received one or more doses of a COVID-19 vaccine in the U.S. on 2021-02-28?,"{'max': 85000000, 'min': 27000000, 'deriv_ratio': 1}",0.39262379310344825,num
4453,What will be the percent of S:N501 sequences in the U.S. among all positive SARS-CoV-2 samples submitted to the GISAID database of genetic sequences between 2021-03-01 and 2021-03-07 (inclusive)?,"{'max': 100, 'min': 0, 'deriv_ratio': 1}",0.2,num
4454,How many variants of concern will be monitored by the US CDC as of  2021–03-07?,"{'max': 8, 'min': 0, 'deriv_ratio': 1}",0.375,num
4455,Will The Kidney Project's implantable bioartificial kidney receive FDA approval before 2025?,"['yes', 'no']",,t/f
4456,Will Elon Musk's Tesla Roadster be visited by any spacecraft before 2050?,"['yes', 'no']",,t/f
4457,What will be the percent of S:N501 sequences in the U.S. among all positive SARS-CoV-2 samples submitted to the GISAID database of genetic sequences between 2021-03-29 and 2021-04-04 (inclusive)?,"{'max': 100, 'min': 0, 'deriv_ratio': 1}",0.51,num
4458,Will a Democrat win the 2024 US presidential election?,"['yes', 'no']",,t/f
4459,Will there be adversarial use of consumer genomic data before 1/1/2030?,"['yes', 'no']",,t/f
4460,What will Bitcoin's percentage of total crypto market capitalization be in 2025?,,,num
4461,Will the single-dose Johnson & Johnson SARS-CoV-2 vaccine be issued an emergency use authorization by the US FDA within a week after the 26 February VRBPAC meeting?,"['yes', 'no']",yes,t/f
4462,When will the Riemann Hypothesis be proved or disproved?,,,num
4463,When will The Economist rank Russia as a Democracy in its Democracy Index?,,,num
4464,Will SpaceX's SN10 Starship prototype vehicle land successfully?,"['yes', 'no']",yes,t/f
4465,When will the mammoth be revived?,,,num
4466,When will the US pass 1 million cumulative deaths from COVID-19?,"{'max': '2022-11-29', 'min': '2021-03-31', 'deriv_ratio': 1}",0.6922880116959065,num
4467,Will JavaScript be the most used programming language in the 2030 Stack Overflow Developer Survey?,"['yes', 'no']",,t/f
4468,Will there be a 10X growth in number of legal abortions conducted in Poland before 2031?,"['yes', 'no']",,t/f
4469,Will a space-based interferometer detect a gravitational wave background attributable to cosmological sources?,"['yes', 'no']",,t/f
4470,Will Bitcoin outperform VTI from 2021-Mar-01 until 2026?,"['yes', 'no']",,t/f
4471,Will the control problem be solved before the creation of Artificial General Intelligence?,"['yes', 'no']",,t/f
4472,Will the University of Pennsylvania send undergraduates back home Spring 2021?,"['yes', 'no']",no,t/f
4473,What will the the sum of the level of performance (in exaFLOPS) of the all 500 supercomputers in the TOP500 be according to their November 2022 list?,,,num
4474,What share (in %) of the world's super-compute performance will be based in the United States in the November 2022 publication of TOP500 list?,,,num
