,q,choices,a,qtype
2523,"Will quantum supremacy be achieved by 2025, rather than proving elusive for years to come if not indefinitely?","['yes', 'no']",yes,t/f
2524,"By 2021, will at least ten Starlink satellites have been launched and be in orbit?","['yes', 'no']",yes,t/f
2525,By 2050 will we have had a one year period in which we will have lost at least 10% of our operational satellites due to collisions with space junk?,"['yes', 'no']",,t/f
2526,"Will this question, with its secret resolution criteria, resolve positive?","['yes', 'no']",no,t/f
2527,"On May 1 will the ICO space still be growing in overall size, and stable in success likelihood?","['yes', 'no']",no,t/f
2528,"Will KIC 9832227 go ""red nova"" – observable to the naked eye on Earth – by 2024?","['yes', 'no']",,t/f
2529,Will Magnus Carlsen retain his title of world chess champion this November?,"['yes', 'no']",yes,t/f
2530,"Will this new material (an optimal composition of hafnium, nitrogen, and carbon: HfN0.38C0.51) – or some other compound – break (or should we say ""melt"") the melting point record by 2021?","['yes', 'no']",no,t/f
2531,Will Democrats win control of the US House of Representatives in 2018?,"['yes', 'no']",yes,t/f
2532,How many US Senate seats will Democrats control after 2018 midterm elections?,"{'max': 58, 'min': 23, 'deriv_ratio': 1}",0.628571428571429,num
2533,When will human beings finally drill into the Earth’s mantle?,,,num
2534,When will the world create the first Trillionaire?,,,num
2535,Will Trump and Kim Jong Un actually meet?,"['yes', 'no']",yes,t/f
2536,By 2025 will someone be able to hold his/her breath for 30+ minutes?,"['yes', 'no']",,t/f
2537,Will the U.S. get rid of the penny by 2025?,"['yes', 'no']",,t/f
2538,Will a human made spaceship enter the Venusian atmosphere before 2030?,"['yes', 'no']",,t/f
2539,Will Temer's Social Security Reform be approved by the end of 2018 or the end of Temer's presidency (whichever comes first)?,"['yes', 'no']",no,t/f
2540,Will Turkish President Recep Tayyip Erdoğan experience a significant leadership disruption by 31 August 2018?,"['yes', 'no']",no,t/f
2541,Will any NATO member invoke Article 4 or Article 5 before 8 September 2018?,"['yes', 'no']",no,t/f
2542,Will Zuckerberg in fact appear before either the US house or Senate prior to April 17?,"['yes', 'no']",yes,t/f
2543,Will the Dems start a new tradition and nominate a Gen Xer for President the next go around?,"['yes', 'no']",no,t/f
2544,When will there be a mile-high building?,,,num
2545,"Will there be a complete 4 year interval in which world output doubles, before the first 1 year interval in which world output doubles?","['yes', 'no']",,t/f
2546,Will SpaceX land anything on Mars before 2030?,"['yes', 'no']",,t/f
2547,How many United Nations Security Council Resolutions concerning Syria will be vetoed by Russia between 22 April 2018 and 22 August 2018?,"{'max': 5, 'min': 0, 'deriv_ratio': 1}",0.0,num
2548,Will there be a locally-transmitted case of the Zika virus in Singapore between 1 April 2018 and 31 May 2018?,"['yes', 'no']",no,t/f
2549,Will a US-led military nuclear first-strike occur in N. Korea by the end of 2018?,"['yes', 'no']",no,t/f
2550,Will Doug Ford be elected the next Premier of Ontario in the upcoming election?,"['yes', 'no']",yes,t/f
2551,How many missile test events will North Korea conduct in May 2018?,"{'max': 5, 'min': 0, 'deriv_ratio': 1}",0.0,num
2552,When will the next fatality happen in an event involving a fully autonomous vehicle?,,,num
2553,Would a Democratically controlled House impeach President Trump before the 2020 elections?,"['yes', 'no']",yes,t/f
2554,Will Puerto Rico become a US state prior to 2035?,"['yes', 'no']",,t/f
2555,"How many House or Senate Republicans will announce their intentions to retire, seek another office, or otherwise abandon their 2018 re-election campaigns?","{'max': 100, 'min': 0, 'deriv_ratio': 1}",0.46,num
2556,"Will there be violent interactions between US protesters and police on May 1, 2018?","['yes', 'no']",yes,t/f
2557,Will 2048-bit RSA be broken before 256-bit ECC?,"['yes', 'no']",,t/f
2558,Will the 1000th binary Metaculus question resolution be positive?,"['yes', 'no']",no,t/f
2559,"How long will this go on, though? When will The Simpsons finally air its last season (and specifically, last episode)?",,,num
2560,"Will Europa be the first place humanity will discover extraterrestrial life, if it is discovered by 2045?","['yes', 'no']",,t/f
2561,Will a member of President Trump's inner circle be sentenced to jail by 2023?,"['yes', 'no']",yes,t/f
2562,How many earthquakes of magnitude 5 or stronger will occur worldwide in May 2018?,"{'max': 250, 'min': 50, 'deriv_ratio': 1}",0.445,num
2563,"When practical nuclear fusion is developed, will it first be in China?","['yes', 'no']",,t/f
2564,Is Westworld located on an island?,"['yes', 'no']",yes,t/f
2565,"In Westworld, is Dolores modeled after a flesh-and-blood human being from outside the park?","['yes', 'no']",no,t/f
2566,What will the estimated weekly production rate displayed by Bloomberg's tracker on the 31st of December 2018?,"{'max': 20000, 'min': 2000, 'deriv_ratio': 10}",0.362765126555426,num
2567,Will Metaculus still be operating on January 1st 2030?,"['yes', 'no']",,t/f
2568,How many House seats will caucus with Democrats at the start of the 2019 session of Congress?,"{'max': 320, 'min': 120, 'deriv_ratio': 1}",0.575,num
2569,How many 'hacking or malware (HACK)' data breaches will Privacy Rights Clearinghouse record in May 2018?,"{'max': 40, 'min': 0, 'deriv_ratio': 1}",0.45,num
2570,Will Ireland's referendum to repeal the Eighth Amendment pass?,"['yes', 'no']",yes,t/f
2571,Will Tesla file for bankruptcy prior to January 1st 2020?,"['yes', 'no']",no,t/f
2572,Will the senate vote to keep in place net neutrality rules?,"['yes', 'no']",yes,t/f
2573,Will the richest person in the world in 2033 have a net worth equivalent to or greater than 2% of the United States' GDP at the time?,"['yes', 'no']",,t/f
2574,Will this outbreak be contained to less than 50 cases of Ebola?,"['yes', 'no']",no,t/f
2575,"By end of 2018, will a published paper or pre-print describe an AI/ML system that has been trained using a number of computations that the method used by OpenAI in the above study would attribute more than operations?","['yes', 'no']",no,t/f
2576,"Will Iran launch a medium, intermediate, or intercontinental range ballistic missile or a satellite between 16 and 23 May 2018?","['yes', 'no']",no,t/f
2577,Will Iran announce it is enriching uranium above the 4.0% level before 23 May 2018?,"['yes', 'no']",no,t/f
2578,"By the end of season 2, will it be revealed that the marble taken from the lab by Bernard contains the mind of Arnold?","['yes', 'no']",no,t/f
2579,What do you think? Will we discover proton decay before 2040?,"['yes', 'no']",,t/f
2580,"Can we prevent a US terrorist attack equal to (or worse than) 9/11 in terms of lives lost, at least through the year 2030?","['yes', 'no']",,t/f
2581,Will a space elevator successfully be built by 2100?,"['yes', 'no']",,t/f
2582,When will Nicolás Maduro leave the office of President?,,,num
2583,"Will there be more than 100 violent deaths of white insurgents before 2023, within a period of 12 months, as reported by a verifiable news outlet?","['yes', 'no']",,t/f
2584,Will China execute or be targeted in an acknowledged national military attack before 1 September 2018?,"['yes', 'no']",no,t/f
2585,Will Kim Jong-un meet the head of government from any G7 nation in-person before 15 June 2018?,"['yes', 'no']",yes,t/f
2586,Will the winner of the 2020 US Presidential election have been elected to any other previous significant political office?,"['yes', 'no']",yes,t/f
2587,Will Donald Trump face a significant primary challenge in 2020?,"['yes', 'no']",no,t/f
2588,Will bitcoin either boom or bust (but not just boringly wander up or down) during 2018?,"['yes', 'no']",yes,t/f
2589,Will Prince Harry and Meghan Markle announce a pregnancy by year's end?,"['yes', 'no']",yes,t/f
2590,Will a MLB pitcher throw a perfect game in 2018?,"['yes', 'no']",no,t/f
2591,"Will there be a locally-transmitted case of the Zika virus in Ukraine, Russia, Georgia or Armenia between 1 June 2018 and 31 August 2018?","['yes', 'no']",no,t/f
2592,"By January 1st, 2020, will a credible reports indicate that a formal submission has been made to a regulatory body proposing to test a malaria-combatting gene drive in a wild population?","['yes', 'no']",no,t/f
2593,When will we get the last communication from Voyager 1?,,,num
2594,Evidence for anomalies in neutrino oscillations to grow or fade away?,"{'max': 5000, 'min': 1, 'deriv_ratio': 5000}",0.50691442785254,num
2595,Will they bring any lunar material back by start of 2023?,"['yes', 'no']",,t/f
2596,A mission associated with Moon Express successfully reach the moon by start of 2021?,"['yes', 'no']",no,t/f
2597,"In which month will there first be 20,000 new papers submitted to the arXiv?",,,num
2598,Will Mike Pence be elected president of the United States in 2024?,"['yes', 'no']",,t/f
2599,When will Vladimir Putin leave power in Russia?,,,num
2600,When will Xi Jinping leave power in China?,,,num
2601,"Will Donald Trump spend any time in jail or prison before June 30, 2028?","['yes', 'no']",,t/f
2602,"Will there be a heavy fuel oil spill of 1,000 gallons or more in the Arctic between 6 June and 8 September 2018?","['yes', 'no']",no,t/f
2603,"In some quarter prior to Q1 2030, will the linked-to index have a value greater than the value 32 quarters (8 years) prior to that quarter?","['yes', 'no']",,t/f
2604,What do you think? When will the next commercial flight break the sound barrier?,,,num
2605,Can Germany retain their FIFA World Cup in 2018?,"['yes', 'no']",no,t/f
2606,"What will be the value of the (herein described) ""AI winter index"" at end of 2021?","{'max': 1, 'min': -1, 'deriv_ratio': 1}",0.25,num
2607,Will India's Chandrayaan-2 mission to the moon blast off before 2018 is out?,"['yes', 'no']",no,t/f
2608,"Will a gravitational wave observatory officially announce the discovery of a 6th black hole-black hole merge by the end of summer 2018 (September 22, 2018)?","['yes', 'no']",no,t/f
2609,Will someone in the U.S. be killed by a drone before 2018 is up?,"['yes', 'no']",no,t/f
2610,Will California be off of daylight savings time in 2020?,"['yes', 'no']",no,t/f
2611,Will Tesla become the world's largest motor vehicle producer in some calendar year prior to 2035?,"['yes', 'no']",,t/f
2612,Will cannabis be removed from Schedule I of the Controlled Substance Act before 2024?,"['yes', 'no']",,t/f
2613,Will Julian Assange still be in the Ecuadorian embassy at the end of 2018?,"['yes', 'no']",yes,t/f
2614,Will at least one of Hayabusa2's rovers or lander touch down on Ryugu and send at least one picture from the surface?,"['yes', 'no']",yes,t/f
2615,Will there be any progress in human lifespan enhancement by 2100?,"['yes', 'no']",,t/f
2616,Will big ISPs bundle website access in the post-net neutrality age?,"['yes', 'no']",no,t/f
2617,Will the General Data Protection Regulation (GDPR) bite a big company?,"['yes', 'no']",yes,t/f
2618,Will a new US Supreme Court Justice be approved in 2018?,"['yes', 'no']",yes,t/f
2619,"Will Roe v. Wade be formally overturned by July 31, 2028?","['yes', 'no']",,t/f
2620,Will Benoit Lecomte successfully swim across the Pacific Ocean?,"['yes', 'no']",no,t/f
2621,Will OpenAI's machine system defeat a pro team at Dota 2 in August?,"['yes', 'no']",yes,t/f
2622,Will the Opportunity Mars rover awaken after the dust storm passes?,"['yes', 'no']",no,t/f
2623,"Will the Trump Adminstration succeed in creating a ""Space Force"" before the 2020 presidential election?","['yes', 'no']",yes,t/f
2624,"When will Leela--or some other self-learning chess engine, along the lines of Alpha Zero--claim the crown and win the official Top Computer Engine Championship (TCEC)?","{'max': '2022-06-01', 'min': '2018-08-01', 'deriv_ratio': 1}",0.214494047619048,num
2625,Will Tesla be profitable in Q3 2018?,"['yes', 'no']",yes,t/f
2626,Will we find the remains of missing Malaysia Air flight 370 by summer's end?,"['yes', 'no']",no,t/f
2627,"But will we see a whole state (e.g. California) pass into law a tax on soda – with the explicit, written intent to disincentivize soda consumption – by Jan 1, 2025?","['yes', 'no']",,t/f
2628,"Before the 21st century is out, will humanity deliberately exterminate at least one species of mosquito using a gene drive?","['yes', 'no']",,t/f
2629,"When will 4 year old Russian chess prodigy, Misha Osipov, reach master level?",,,num
2630,Will Michael Phelps be tempted out of retirement to compete in the 2020 Olympics?,"['yes', 'no']",no,t/f
2631,Will at least one cave-trapped Thai teenager enter a pressurized submarine system provided by Musk?,"['yes', 'no']",no,t/f
2632,When will the next Millennium Prize Problem be solved?,,,num
2633,"Will there be an X-Class solar flare before October 1, 2018?","['yes', 'no']",no,t/f
2634,Will the IBM's Summit remain the top dog in supercomputing power?,"['yes', 'no']",yes,t/f
2635,Will there be a city on Earth with a population of over 100 million by 2100?,"['yes', 'no']",,t/f
2636,When will a climber beat Alex Honnold and Tommy Caldwell's record for climbing the Nose of El Capitan?,,,num
2637,on what date will researchers publicly announce the first confirmed neutrino detection at INO?,,,num
2638,How long will the Great Pyramids be recognizable?,,,num
2639,"Will humanity (essentially) run out of at least one element currently considered ""under serious threat"" by 2040?","['yes', 'no']",,t/f
2640,"Before 2051, will a meteor cause more injuries than the one that shook Chelyabinsk, Russia in 2013?","['yes', 'no']",,t/f
2641,Will ANY of the top 10 most popular baby names in the U.S. (as of 2018) still be in the top 10 in 2048?,"['yes', 'no']",,t/f
2642,Will there be a 9 foot tall human by 2075?,"['yes', 'no']",,t/f
2643,"Of the 10 major AI companies listed below, as of Oct 21 2018 how many will publicly state a policy not to develop lethal autonomous weapons?","{'max': 10, 'min': 2, 'deriv_ratio': 1}",0.0,num
2644,"Before 8 September 2018, will any of the remaining signatories to the Iran nuclear deal announce they are withdrawing?","['yes', 'no']",no,t/f
2645,Will the total interest in Elon Musk on Google Trends in 2025 be less than a quarter of his total interest in 2020?,"['yes', 'no']",,t/f
2646,"When will the US student loan debt bubble ""pop""?",,,num
2647,When (if ever) will the Arctic be essentially ice-free?,,,num
2648,How many years from now will the last member of homo sapiens be born?,,,num
2649,"Will the next assassination of a sitting US President occur after January 1, 2100?","['yes', 'no']",,t/f
2650,Will Donald Trump's approval rating decline noticeably in the wake of the Helsinki Summit?,"['yes', 'no']",no,t/f
2651,Will Trump be reelected president if the election is called by November 10th 2020?,"['yes', 'no']",no,t/f
2652,Will a scientific mission to the outer solar system be assigned to the Falcon Heavy within the next 5 years?,"['yes', 'no']",yes,t/f
2653,Will the UK leave the EU by the end of June 2020?,"['yes', 'no']",yes,t/f
2654,Will Daenerys Targaryen die in season eight of Game of Thrones?,"['yes', 'no']",yes,t/f
2655,Will interest in Veganism decrease prior to 2020?,"['yes', 'no']",no,t/f
2656,"Will a new Supreme Court Justice be confirmed by the Senate before November 6, 2018?","['yes', 'no']",yes,t/f
2657,Will one of Kamala Harris or Bernie Sanders win the Democratic nomination for the 2020 presidential election?,"['yes', 'no']",no,t/f
2658,Will Ray Kurzweil be proven generally right in his predictions?,"['yes', 'no']",,t/f
2659,Will the latest Ebola outbreak be stopped before it claims a hundred lives?,"['yes', 'no']",no,t/f
2660,"Will global malaria mortality rates be reduced by 90% when compared with 2015 rates, by 2030?","['yes', 'no']",,t/f
2661,Will Donald Trump Jr. be charged with a crime by Christmas Day 2018?,"['yes', 'no']",no,t/f
2662,"Will a Deepfake video, qualifying per Hwang's criteria, throw the electorate for a loop during the midterm elections?","['yes', 'no']",no,t/f
2663,Will the UK leave the EU without reaching any agreement?,"['yes', 'no']",no,t/f
2664,Drake's Equation 1st Parameter R∗: What is the average rate of formation of suitable stars (stars/year) in our galaxy?,,,num
2665,Drake's Equation 2nd parameter f_p: What fraction of stars form planets?,,,num
2666,Drake's Equation 3rd parameter n_e: What is the average number of habitable planets per star?,,,num
2667,Drake's Equation 4th parameter f_l: On what fraction of habitable planets does any form of life emerge?,,,num
2668,Drake's Equation 5th parameter f_i: On what fraction of habitable planets with life does intelligence evolve?,,,num
2669,Drake's Equation 6th parameter f_c: What fraction of planets with intelligent life are capable of interstellar communication?,,,num
2670,Drake's Equation 7th parameter L: For how many years does a civilization remain detectable?,,,num
2671,Will Tesla be a private company at some point prior to 2020?,"['yes', 'no']",no,t/f
2672,Will there be a significant increase in worldwide search interest in the term “power outage” reported by Google Trends between 24 August 2018 and 7 September 2018?,"['yes', 'no']",no,t/f
2673,Will a mission to land a spacecraft on Europa launch by 2030?,"['yes', 'no']",,t/f
2674,Will Elon Musk be sanctioned for Tesla buyout tweet?,"['yes', 'no']",yes,t/f
2675,"Will the first crewed SpaceX (test) launch take place prior to January 1st , 2020 at 00:00 UTC?","['yes', 'no']",no,t/f
2676,Will Donald Trump submit to questioning as part of Mueller's investigation?,"['yes', 'no']",no,t/f
2677,"Before 8 September 2018, will the UK request an extension to Article 50 for leaving the EU?","['yes', 'no']",no,t/f
2678,Will OpenAI Five win the majority of its DotA 2 matches at The International?,"['yes', 'no']",no,t/f
2679,Will Coleman Rogers be revealed as Q by September 16th?,"['yes', 'no']",no,t/f
2680,Will the 2018 US Midterm elections be hacked?,"['yes', 'no']",no,t/f
2681,Will an NFL player die during a game during the 2018-2019 season?,"['yes', 'no']",no,t/f
2682,Will someone run a marathon in less than 2 hours (per IAAF rules) by 2023?,"['yes', 'no']",,t/f
2683,How many Senate Democrats will vote to confirm Brett Kavanaugh to the Supreme Court?,"{'max': 49, 'min': 0, 'deriv_ratio': 1}",0.0204081632653061,num
2684,"So, out of 100 Senate seats, how many will be occupied by women on January 3?","{'max': 80, 'min': 20, 'deriv_ratio': 1}",0.0833333333333333,num
2685,Will Israel be the fourth country to soft-land a spacecraft on the Moon?,"['yes', 'no']",,t/f
2686,"Will the U.S. enter a recession by July 1, 2019?","['yes', 'no']",no,t/f
2687,"Will the U.S. enter a recession by July 1, 2020?","['yes', 'no']",yes,t/f
2688,"Will the U.S. enter a recession by July 1, 2021?","['yes', 'no']",yes,t/f
2689,Will OpenAI Five win the first of its DotA 2 matches at The International?,"['yes', 'no']",no,t/f
2690,Qualia Research Institute Question Series: Will MDMA be approved for the treatment of PTSD by 2025?,"['yes', 'no']",,t/f
2691,Qualia Research Institute Question Series: Will Psilocybin be a clinically approved treatment for end-of-life anxiety by 2027?,"['yes', 'no']",,t/f
2692,Will we see evidence that Piracetam is a more effective Alzheimer's treatment than Memantine by 2021?,"['yes', 'no']",no,t/f
2693,Will a woman win the 2018 Royal Society Insight Investment Science Book Prize?,"['yes', 'no']",yes,t/f
2694,Will the both the Metaculus prediction odds and the community prediction odds of a positive resolution to our question on human-machine intelligence parity at least triple within any two-month period before its close date?,"['yes', 'no']",,t/f
2695,Will Parker Solar Probe survive its 24 loops around the sun while getting just a few million miles away from the surface of our star?,"['yes', 'no']",,t/f
2696,"Will Amazon announce the location for its HQ2 before October 1, 2018?","['yes', 'no']",no,t/f
2697,Does P = NP?,"['yes', 'no']",,t/f
2698,Will Jordan Peterson endorse Maxime Bernier as Canada's next Prime Minister ahead of the 2019 Canadian federal election?,"['yes', 'no']",no,t/f
2699,Will Texas elect a Democratic senator in 2018?,"['yes', 'no']",no,t/f
2700,When will a TFLOPS cost less than $1?,,,num
2701,"Will a recent paper, ""Evidence for Superconductivity at Ambient Temperature and Pressure in Nanostructures"", claiming a breakthrough in high-T superconductivity be published in Nature?","['yes', 'no']",no,t/f
2702,"Will Apple's market cap exceed Amazon's on February 1, 2019?","['yes', 'no']",no,t/f
2703,Will the identity of the anonymous administration figure who authored the NYT editorial be discovered by Nov 6 2018?,"['yes', 'no']",no,t/f
2704,Will the total interest in Effective Altruism on Google Trends in 2020 be more than 1.5 times the total interest in 2017?,"['yes', 'no']",no,t/f
2705,When will the average ticket price in US cinemas hit the $10 threshold?,,,num
2706,Will Half-Life 3 come out during Gabe Newell's lifetime?,"['yes', 'no']",,t/f
2707,"How many Executive Orders will President Trump have issued, on a weekly basis, prior to 2021 and while he is president?","{'max': 3, 'min': 0, 'deriv_ratio': 1}",0.3513815684333333,num
2708,When will another nation than the four mentioned launch a person into orbit on their own vehicle?,,,num
2709,Will humans have sustainable settlements off Earth by 2100?,"['yes', 'no']",,t/f
2710,Will the fraction of American 18-24 year-olds enrolled in traditional four-year colleges in 2025 be more than 10% lower than in 2015?,"['yes', 'no']",,t/f
2711,When will an India send their first astronaut/gaganaut into space?,,,num
2712,When will longest duration anyone has ever been in space surpass 5 years?,,,num
2713,"How many countries will be designated as 'Free' in 2028, according to Freedom House?",,,num
2714,"How many countries will be designated as 'Not Free' in 2028, according to Freedom House?",,,num
2715,"Will an authenticated tape of Trump saying the n-word behind the scenes of ""The Apprentice"" surface before Election Day, 2020?","['yes', 'no']",no,t/f
2716,Will Pope Francis resign by the end of 2018?,"['yes', 'no']",no,t/f
2717,Will an openly LGBTQ person be elected President of the United States by 2041?,"['yes', 'no']",,t/f
2718,When will the first YouTube star – famous FIRST because of YouTube stardom – be elected to Congress?,,,num
2719,When will the world see the first cashless society?,,,num
2720,Will one BTC be at or above 12000 USD at least at one point between 20th September 2018 and 31st December 2018 on coinmarketcap.com?,"['yes', 'no']",no,t/f
2721,What will be the total aggregate score given to China by Freedom House in 2028?,,,num
2722,Will 2019 be the warmest year on record?,"['yes', 'no']",no,t/f
2723,Does Atiyah have an actual proof of the Riemann hypothesis?,"['yes', 'no']",no,t/f
2724,Will Angela Merkel remain chancellor after the next German federal elections?,"['yes', 'no']",no,t/f
2725,"By 2023, will there be evidence for a neurological correlate of human consciousness?","['yes', 'no']",,t/f
2726,Will Donald Trump tweet about QAnon before the end of October?,"['yes', 'no']",no,t/f
2727,Will Xi Jinping keep leading China past 2022?,"['yes', 'no']",,t/f
2728,Will we know what Dark Matter is before 2050?,"['yes', 'no']",,t/f
2729,Which percentage of Metaculus questions resolving from October 1st to December 31st 2018 (inclusive) will resolve positively?,"{'max': 100, 'min': 0, 'deriv_ratio': 1}",0.39,num
2730,Will NASA land people on Mars prior to 2030?,"['yes', 'no']",,t/f
2731,Will the world still have nuclear weapons through 2075?,"['yes', 'no']",,t/f
2732,Will the mission arrive on time? Will the ELT see first light in 2024?,"['yes', 'no']",,t/f
2733,Will there be another mass shooting in the U.S. (at least 20 casualties) by end of the year?,"['yes', 'no']",yes,t/f
2734,"Will any intelligent living being (human descendants, aliens, etc.) ever listen to the copy of Blind Willie Johnson's ""Dark Was the Night"" on Voyager I's Golden Record?","['yes', 'no']",,t/f
2735,When will either the Democratic or Republican party in the US cease to exist?,,,num
2736,What percentage of Americans will be obese or overweight in 2030?,,,num
2737,"Will the U.S. Senate vote on the confirmation of Brett Kavanaugh before Monday, October the 8th?","['yes', 'no']",yes,t/f
2738,Which percentage of Metaculus questions resolving in Q1 2019 will resolve positively?,"{'max': 100, 'min': 0, 'deriv_ratio': 1}",0.175,num
2739,What will be Top500's #1 performing supercomputer as a multiple of the #500 performer in 2030?,,,num
2740,Ragnarök Question Series: By 2100 will the human population decrease by at least 10% during any period of 5 years?,"['yes', 'no']",,t/f
2741,"If a global catastrophe happens before 2100, will it be principally due to the deployment of nuclear weapons?","['yes', 'no']",,t/f
2742,"If a global catastrophe happens before 2100, will it be principally due to the deployment of some artificial intelligence system(s)?","['yes', 'no']",,t/f
2743,Will the eventual consensus explanation of star KIC 8462852 variability be an intervening molecular cloud?,"['yes', 'no']",,t/f
2744,Will Donald Trump appoint at least one more Justice to the Supreme Court before the end of his presidency?,"['yes', 'no']",yes,t/f
2745,"If a global catastrophe happens before 2100, will it be principally due to human-made climate change, or the use of geoengineering as a deliberate large-scale intervention in the Earth’s climate system?","['yes', 'no']",,t/f
2746,"If a global catastrophe happens before 2100, will it be principally due to the deployment nanotechnology?","['yes', 'no']",,t/f
