,q,choices,a,qtype
0,What will the end-of-day closing value for the dollar against the renminbi be on 1 January 2016?,"['Less than 6.30', 'Between 6.30 and 6.35, inclusive', 'More than 6.35 but less than 6.40', '6.40 or more']",D,mc
1,How many seats will the Justice and Development Party (AKP) win in Turkey's snap elections?,"['A majority', 'A plurality', 'Not a plurality']",A,mc
2,Will there be an initial public offering on either the Shanghai Stock Exchange or the Shenzhen Stock Exchange before 1 January 2016?,"['yes', 'no']",yes,t/f
3,Will the Export-Import Bank of the United States be re-authorized before 1 January 2016?,"['yes', 'no']",yes,t/f
4,"Will a trilateral meeting take place between Chinese President Xi Jinping, Japanese Prime Minister Shinzo Abe, and South Korean President Park Geun-hye before 1 January 2016?","['yes', 'no']",no,t/f
5,Will Iran release Jason Rezaian before 31 October 2016?,"['yes', 'no']",yes,t/f
6,"Will North Korea launch a land based missile with the capacity to reach Alaska, Hawaii, or the continental United States before 1 January 2017?","['yes', 'no']",yes,t/f
7,Will the government of Venezuela or Petroleos de Venezuela S. A. (PDVSA) default on their foreign-currency debt before 1 March 2016?,"['yes', 'no']",no,t/f
8,"Will Russia officially lift any part of its food embargo on the United States, any or all of the European Union member states, Canada, Australia, Norway, Iceland, Albania, Montenegro or Liechtenstein before 6 August 2016?","['yes', 'no']",yes,t/f
9,Will Congress pass a resolution disapproving the Joint Comprehensive Plan of Action?,"['No', 'Yes, but the resolution will be vetoed by the President and the veto will stand', 'Yes, and the resolution will become law']",A,mc
10,Will OPEC announce any changes to its production quota before 1 January 2016?,"['yes', 'no']",no,t/f
11,"Will the city of Venice lift its ban on ""Jean A Deux Mamans"" or ""Piccolo Uovo"" before 1 September 2016?","['yes', 'no']",no,t/f
12,Will Africa remain free of the wild poliovirus through 31 December 2016?,"['yes', 'no']",no,t/f
13,Will Bashar al-Assad cease to be President of Syria before 1 March 2017?,"['yes', 'no']",no,t/f
14,"Will the book “Superforecasting"" (2015) be on the New York Times Bestseller's list by the end of October?","['yes', 'no']",yes,t/f
15,Will Iran's President Hassan Rouhani meet Saudi Arabia's King Salman bin Abdulaziz Al Saud before 1 September 2016?,"['yes', 'no']",no,t/f
16,Will negotiations on the Transatlantic Trade and Investment Partnership (TTIP) be completed before 1 January 2017?,"['yes', 'no']",no,t/f
17,Will Iran host a head of state or head of government from one of the G7 countries on an official visit before 1 July 2016?,"['yes', 'no']",yes,t/f
18,Who will win the presidential election in Argentina?,"['Someone else', 'Sergio Massa', 'Mauricio Macri', 'Daniel Scioli']",C,mc
19,Will Brazil's President Dilma Rousseff resign or be impeached before 1 April 2016?,"['yes', 'no']",no,t/f
20,How many seats in Poland's Sejm will PiS (Law and Justice) win in the upcoming parliamentary elections?,"['Majority', 'Plurality', 'Not a Plurality']",A,mc
21,Will the US federal-funds rate be increased before the end of the year [2015]?,"['yes', 'no']",yes,t/f
22,Which main character will be the first to die in Season 6 of the Walking Dead?,"['All of the above will survive season 6', 'Glenn', 'Rick', 'Carl', 'Daryl', 'Carol']",A,mc
23,Who will win the World Series?,"['A team from the National League', ' A team from the American League']",B,mc
24,Will the Iranian Parliament approve the Joint Comprehensive Plan of Action before 1 November 2015?,"['yes', 'no']",yes,t/f
25,Will the IAEA conduct an on-site inspection of the Parchin military complex in Iran before the end of the year?,"['yes', 'no']",yes,t/f
26,Will restrictions on Iran's access to SWIFT be lifted before 1 August 2016?,"['yes', 'no']",yes,t/f
27,"Before 1 January 2017, will it be officially announced that Greece is leaving the eurozone?","['yes', 'no']",no,t/f
28,"What will be the lowest closing spot price for West Texas Intermediate crude oil, according to the US Energy Information Agency, between 14 September 2015 and 30 December 2015?","['Between $34.00 and $40.00 per barrel, inclusive', 'More than $40.00 per barrel', 'Less than $34.00 per barrel']",A,mc
29,Will both houses of Congress pass legislation lifting or relaxing the oil-export ban before 1 April 2016?,"['yes', 'no']",yes,t/f
30,Will China officially declare an Air-Defense Identification Zone (ADIZ) over any part of the South China Sea before 1 October 2016?,"['yes', 'no']",no,t/f
31,Will Jurassic World (2015) pass Titanic (1997) to become the #2 all-time highest-grossing movie domestically by the end of the year?,"['yes', 'no']",no,t/f
32,"Will the conviction of Adnan Syed, featured on the ""Serial"" podcast, be overturned before the end of 2016?","['yes', 'no']",yes,t/f
33,Will Joe Biden announce that he is running for President of the United States before Thanksgiving?,"['yes', 'no']",no,t/f
34,Will Donald Trump win Iowa's Republican caucus?,"['yes', 'no']",no,t/f
35,Will Hillary Clinton win New Hampshire's Democratic primary?,"['yes', 'no']",no,t/f
36,Will there be a dissolution or suspension of the Northern Irish Assembly before the end of the year?,"['yes', 'no']",no,t/f
37,Which party will the next Canadian Prime Minister come from?,"['Conservative', 'Liberal', 'New Democratic Party', 'Other']",B,mc
38,Will Russians conduct airstrikes in Syria before 1 May 2016?,"['yes', 'no']",yes,t/f
39,Who will Twitter name as their permanent CEO before the end of the year?,"['Someone else', 'No one will be named CEO before the end of the year', 'Jack Dorsey', 'Adam Bain', 'Anthony Noto']",C,mc
40,Will Roger Goodell be commissioner of the NFL at the start of the 2016 regular season?,"['yes', 'no']",yes,t/f
41,"As of 31 December 2015, how many refugees and migrants will UNHCR report as having arrived in Europe by sea?","['Less than 560,000', 'Between 560,000 and 710,000, inclusive', 'More than 710,000 but less than 1 million', '1 million or more']",D,mc
42,What will be the average number of Bitcoin transactions per day in the first week of June 2016?,"['More than 250,000', 'Less than 125,000', 'Between 125,000 and 250,000, inclusive']",C,mc
43,Will Apple sell more than 75 million iPhones in its December quarter?,"['yes', 'no']",no,t/f
44,How many seats in Taiwan's Legislative Yuan will the Democratic Progressive Party (DPP) win in January's elections?,"['Plurality', 'Majority', 'Not a plurality']",B,mc
45,Will there be a partial or full government shutdown in the United States before the end of the year?,"['yes', 'no']",no,t/f
46,"Before the end of the year, will the Bank of Japan announce an increase in asset purchases under its quantitative easing program?","['yes', 'no']",no,t/f
47,Will any disputes over IAEA access to Iranian sites be referred to the Joint Commission before 1 July 2016?,"['yes', 'no']",no,t/f
48,Will the IAEA verify that Iran's uranium stockpile has been reduced to less than 300 kg of low-enriched uranium before 1 June 2016?,"['yes', 'no']",yes,t/f
49,Will either of the following parties be part of the ruling coalition after Spain's upcoming elections?,"['Podemos', 'Ciudadanos', 'Both', 'Neither']",D,mc
50,Will NATO invite Montenegro to join the alliance before the end of the year?,"['yes', 'no']",yes,t/f
51,Will Malaysia impose capital controls before 1 October 2016?,"['yes', 'no']",no,t/f
52,Will Winds of Winter be released before Season 6 of Game of Thrones airs?,"['yes', 'no']",no,t/f
53,How many countries will Russia remove from its food embargo list before 6 August 2016?,"['0', 'Between 1 and 5, inclusive', 'More than five, but less than all', 'All']",A,mc
54,Will the US or its coalition partners declare a no-fly zone in Syria before the end of the year?,"['yes', 'no']",no,t/f
55,Will there be a new King of Saudi Arabia before 1 June 2016?,"['No', 'Yes, Mohammed bin Nayef', 'Yes, Mohammed bin Salman', 'Yes, Muqrin bin Abdulaziz', 'Yes, Someone else']",A,mc
56,Will the US Justice Department file criminal charges against Volkswagen or any of its employees before 30 March 2016?,"['yes', 'no']",no,t/f
57,Will President Putin meet with Prime Minister Abe in Japan before 1 July 2016?,"['yes', 'no']",no,t/f
58,Will the United Socialist Party of Venezuela (PSUV) maintain its majority in Venezuela's National Assembly after the next legislative elections?,"['yes', 'no']",no,t/f
59,Will negotiations on the Regional Comprehensive Economic Partnership (RCEP) be completed before 1 January 2016?,"['yes', 'no']",no,t/f
60,Will any NATO member invoke Article 4 in response to actions taken by Russia before 1 January 2017?,"['yes', 'no']",no,t/f
61,When will Iran next launch a ballistic missile?,"['Before 1 March 2016', 'Between 1 March and 30 April 2016, inclusive', 'Between 1 May and 30 June 2016, inclusive', 'Not before 1 July 2016']",A,mc
62,"Will ""implementation day"" for the Iranian nuclear deal occur before Iran's legislative elections?","['yes', 'no']",yes,t/f
63,Will there be a lethal confrontation in the South or East China Sea region involving China's and another country's national military forces or law enforcement personnel before 1 January 2017?,"['yes', 'no']",no,t/f
64,Will either the Palestinian Authority or Israel announce a halt in security cooperation before 1 July 2016?,"['yes', 'no']",no,t/f
65,"Will Montenegro's Milo Djukanovic resign, lose a vote of confidence, or cease to be Prime Minister before 1 January 2016?","['yes', 'no']",no,t/f
66,Will North Korea conduct a nuclear test before 1 January 2017?,"['yes', 'no']",yes,t/f
67,"Before 1 August 2016, will any NATO members invoke Article 4 or Article 5 in response to actions taken by ISIS?","['Yes, only Article 4', 'Yes, only Article 5', 'Yes, both Article 4 and Article 5', 'No']",D,mc
68,Will the expanded Panama Canal open to shipping before 15 May 2016?,"['yes', 'no']",no,t/f
69,"Will Vladimir Putin attend the Nuclear Security Summit in Washington, DC, in March 2016?","['yes', 'no']",no,t/f
70,"Before 1 May 2016, will Britain set a date for a referendum on EU membership?","['yes', 'no']",yes,t/f
71,Who will win the Republican Party nomination for the US presidential election?,"['Jeb Bush', 'Ben Carson', 'Ted Cruz', 'Carly Fiorina', ' Marco Rubio', 'Donald Trump', ' None of the above']",F,mc
72,Will Turkey impose capital controls before 1 December 2016 ?,"['yes', 'no']",no,t/f
73,Will Afghanistan's Parliament confirm a Minister of Defense before 1 July 2016?,"['yes', 'no']",yes,t/f
74,Will China conduct naval exercises with any ASEAN member before 1 June 2016?,"['yes', 'no']",yes,t/f
75,Who will be the next managing director of the IMF?,"['Someone else from Europe', 'Christine Lagarde will serve a second term', 'Someone from outside Europe']",B,mc
76,Which team will win the NFL’s Super Bowl in 2016?,"['Carolina Panthers (was a team from the NFC)', 'Denver Broncos (was a team from the AFC)']",B,mc
77,How will Iran rank in the World Economic Forum’s 2016-2017 Global Competitiveness Index?,"['In the top 50', 'Between 51 and 60, inclusive', 'Between 61 and 75, inclusive', 'Above 75']",D,mc
78,Will either Turkey or Russia officially suspend or cancel the Akkuyu nuclear power plant project before the end of 2016?,"['yes', 'no']",no,t/f
79,How many of the BRIC countries will report positive annualised growth for the quarter ending in December 2015?,"['None', 'One', 'Two', 'Three', 'Four']",C,mc
80,"Before 1 January 2017, will TIME magazine announce that they will no longer be publishing a weekly print edition in the US?","['yes', 'no']",no,t/f
81,Will a member of the National League for Democracy (NLD) take office as president of Myanmar before April 2016?,"['yes', 'no']",yes,t/f
82,"Before April 2016, will the French Army or Foreign Legion deploy combat troops to fight the Islamic State on the ground in Syria or Iraq?","['yes', 'no']",no,t/f
83,"Before the end of 2016, will a North American country, the EU, or an EU member state impose sanctions on another country in response to a cyber attack or cyber espionage?","['yes', 'no']",yes,t/f
84,Will Montenegro become a NATO member in 2016?,"['yes', 'no']",no,t/f
85,Will conservatives retain their majority in the Majles after Iran's upcoming parliamentary elections?,"['yes', 'no']",no,t/f
86,Will India win the 2016 ICC World Twenty20 cricket tournament?,"['yes', 'no']",no,t/f
87,Will anti-Islamic State forces retake Mosul before 1 January 2017?,"['yes', 'no']",no,t/f
88,Who will win Uganda's next presidential election?,"['Yoweri Museveni', 'Amama Mbabazi', 'Kizza Besigye', 'None of the above']",A,mc
89,Will six party talks on North Korea's nuclear weapons program resume before 1 January 2017?,"['yes', 'no']",no,t/f
90,Which toy will win the Innovative Toy of the Year Award for 2016?,"['Star Wars Science - Jedi Force Levitator', ""Flipsies™ Sandy's House & Ocean Cruiser"", ' i-loom', ' Laser Maze™ Jr.', 'Makey Makey Classic', 'Meccanoid G15', 'MiPosaur']",F,mc
91,Will more than 1 million refugees and migrants arrive in Europe by sea in 2016?,"['yes', 'no']",no,t/f
92,How many new jobs will the US economy create in January 2016?,"['Less than 175,000', 'Between 175,000 and 225,000, inclusive', 'More than 225,000']",A,mc
93,Will Moody's downgrade South Africa's government issuer rating to B or below before 1 April 2016?,"['yes', 'no']",no,t/f
94,How many Eritrean citizens will apply for asylum in Europe for the first time in the first quarter of 2016?,"['Less than 10,000', 'Between 10,000 and 15,000, inclusive', 'More than 15,000']",A,mc
95,Will California extend the current restriction on urban water use before it expires on 29 February 2016?,"['yes', 'no']",yes,t/f
96,Will Russia conduct a naval exercise in the Western Hemisphere with a Central or South American country before 1 July 2016?,"['yes', 'no']",no,t/f
97,Will there be any publicly disclosed cyber attacks on nuclear facilities before the end of 2016?,"['yes', 'no']",no,t/f
98,Will local elections be held in the city of Donetsk before 1 May 2016?,"[' Yes, and the elections will be recognized by the government of Ukraine', 'Yes, but the elections will not be recognized by the government in Ukraine', 'No']",C,mc
99,Will negotiations on the Regional Comprehensive Economic Partnership (RCEP) be completed in 2016?,"['yes', 'no']",no,t/f
100,Who will be the next mayor of London?,"['Sadiq Khan', 'None of the above', 'Zac Goldsmith']",A,mc
101,Will Syria hold UN-backed elections before 1 January 2018?,"['yes', 'no']",no,t/f
102,Who will win the Democratic Party nomination for the US presidential election?,"['Hillary Clinton', 'Martin O’Malley', 'Bernie Sanders']",A,mc
103,Which Republican presidential candidate will win the Iowa caucuses on 1 February?,"['Jeb Bush', 'Ben Carson', 'Mike Huckabee', 'Chris Christie', 'Ted Cruz', 'Carly Fiorina', 'Jim Gilmore', 'John Kasich', 'Rand Paul', 'Marco Rubio', 'Rick Santorum', 'Donald Trump']",E,mc
104,Which Democratic presidential candidate will win the Iowa caucuses on 1 February?,"['Hillary Clinton', 'Martin O’Malley', 'Bernie Sanders']",A,mc
105,Which Republican presidential candidate will win the New Hampshire primary on 9 February?,"['Rand Paul', 'Marco Rubio', 'Ben Carson', 'Donald Trump', 'Jim Gilmore', 'John Kasich', 'Chris Christie', 'Rick Santorum', 'Ted Cruz', 'Jeb Bush', 'Carly Fiorina', 'Mike Huckabee']",D,mc
106,"Will the Republican candidate for president win the party's nomination on the first ballot, at the party's convention in July?","['yes', 'no']",yes,t/f
107,Who will win the 2016 US presidential election?,"['A Democrat', 'A Republican', 'Other']",B,mc
108,Which movie will win the Oscar for Best Picture?,"['The Big Short', 'Bridge of Spies', 'Brooklyn', 'The Martian', 'Mad Max: Fury Road', 'Room', 'The Revenant', 'Spotlight']",H,mc
109,Will the government of Colombia and the FARC sign a final peace agreement before 1 May 2016?,"['yes', 'no']",no,t/f
110,Will there be a new episode of mass killing in Burundi before 1 January 2017?,"['yes', 'no']",no,t/f
111,Will there be a new episode of mass killing in Ethiopia before 1 January 2017?,"['yes', 'no']",yes,t/f
112,Will there be a new episode of mass killing in Myanmar before 1 January 2017?,"['yes', 'no']",no,t/f
113,How many seats will United Russia win in September's Russian State Duma elections?,"['Less than half', 'At least two-thirds of all seats', 'At least one-half but less than two-thirds']",B,mc
114,Will Google's AlphaGo beat world champion Lee Sedol in the five-game Go match planned for March 2016?,"['yes', 'no']",yes,t/f
115,When will Germany announce that it is limiting the total number of asylum seekers or refugees that it will accept?,"['Before 13 March 2016', 'Between 13 March and 30 June 2016, inclusive', 'Not before 1 July 2016']",C,mc
116,Will the UN Security Council pass a resolution expanding sanctions on North Korea before 1 June 2016?,"['yes', 'no']",yes,t/f
117,"Will Bahrain, Qatar, or the UAE return an ambassador to Iran before 18 October 2016?","['No', 'Yes, after Saudi Arabia announces that its ambassador will return to Tehran', 'Yes, before Saudi Arabia announces that its ambassador will return to Tehran']",A,mc
118,Will the US or the UN impose any new sanctions on Iran before 18 October 2016?,"['yes', 'no']",yes,t/f
119,Will the United States remove Iran from the list of countries identified as state sponsors of terrorism before 18 October 2016?,"['yes', 'no']",no,t/f
120,"After the Super Tuesday primaries, which Democratic candidate will have won the most pledged delegates?","['Hillary Clinton', 'Bernie Sanders']",A,mc
121,"After the Super Tuesday primaries, which Republican candidate will have won the most pledged delegates?","[' Jeb Bush', 'Ben Carson', ' Ted Cruz', 'Jim Gilmore', ' John Kasich', 'Marco Rubio', 'Donald Trump']",G,mc
122,Will the Centers for Disease Control elevate their travel guidance for Brazil to Warning Level 3 due to the Zika virus before the Olympics begin?,"['yes', 'no']",no,t/f
123,Who will win the upcoming Philippine presidential election?,"[' Jejomar Binay', 'Miriam Defensor-Santiago', 'Rodrigo Duterte', 'Grace Poe', 'Mar Roxas', 'None of the above']",C,mc
124,Will China conduct bilateral military exercises with either Iran or Saudi Arabia before 1 October 2016?,"['Yes, with only Iran', 'Yes, with both', 'Yes, with only Saudi Arabia', 'No']",D,mc
125,Will the closing spot price for a barrel of Brent crude oil dip below $20.00 before 1 May 2016?,"['yes', 'no']",no,t/f
126,"(Conditional) If Donald Trump wins the Republican nomination, which party will win the U.S. presidential election?","['Republican', 'Other', 'Democrat']",A,mc
127,Will Syrian government forces retake the city of Aleppo before 1 July 2016?,"['yes', 'no']",no,t/f
128,Will a majority of voters in Britain's upcoming referendum elect to remain in the European Union?,"['yes', 'no']",no,t/f
129,Will a new Supreme Court Justice be appointed before 20 January 2017?,"['yes', 'no']",no,t/f
130,Which Republican presidential candidate will win the Ohio primary on 15 March?,"['Ted Cruz', ' John Kasich', 'Marco Rubio', 'Donald Trump']",B,mc
131,Which Republican presidential candidate will win the Florida primary on 15 March?,"['Ted Cruz', 'Donald Trump', 'John Kasich', 'Marco Rubio']",B,mc
132,Will Keiko Fujimori win Peru's upcoming presidential election?,"['yes', 'no']",no,t/f
133,What will be the end-of-day closing value for the dollar against the renminbi on 30 September 2016?,"[' Less than 6.40', 'Between 6.40 and 6.60, inclusive', 'More than 6.60 but less than 6.80', '6.80 or more']",C,mc
134,Will there be a new episode of mass killing in Nigeria before 1 January 2017?,"['yes', 'no']",no,t/f
135,Will there be a new episode of mass killing in Zimbabwe before 1 January 2017?,"['yes', 'no']",no,t/f
136,Will there be a new episode of mass killing in Democratic Republic of Congo before 1 January 2017?,"['yes', 'no']",no,t/f
137,Which party will control the US Senate after the November 2016 election?,"['Democrats', 'Republicans']",B,mc
138,Which party will control the US House of Representatives after the November 2016 election?,"['Democrats', 'Republicans']",B,mc
139,Will Iran agree to cap its oil output before 1 July 2016?,"['yes', 'no']",no,t/f
140,Will Venezuela or its state-owned oil company Petroleos de Venezuela SA (PDVSA) default on any of its foreign debt before 1 February 2017?,"['yes', 'no']",no,t/f
141,When will John Kasich drop out of the race for the Republican presidential nomination?,"['Before the New York primary', 'After the New York primary but before the Nebraska primary', 'After the Nebraska primary but before the California primary', 'After the California primary but before the Republican National Convention begins', 'Not before the Republican National Convention']",B,mc
142,When will Ted Cruz drop out of the race for the Republican presidential nomination?,"['Before the New York primary', 'After the New York primary but before the Nebraska primary', 'After the Nebraska primary but before the California primary', 'After the California primary but before the Republican National Convention begins', 'Not before the Republican National Convention']",B,mc
143,When will clinical human trials for a Zika vaccine begin?,"['Before 1 January 2017', 'Between 1 January 2017 and 30 June 2017', 'Not before 1 July 2017']",A,mc
144,"In 2016 will the Permanent Court of Arbitration rule that China's ""nine-dash line"" is contrary to the UN Convention on the Law of the Sea (UNCLOS)?","['yes', 'no']",yes,t/f
145,"Will Tesla Motors deliver more than 80,000 BEVs to customers in calendar year 2016?","['yes', 'no']",no,t/f
146,Will any other US state adopt California's Zero Emission Vehicle (ZEV) Mandate before 1 January 2017?,"['yes', 'no']",no,t/f
147,Which team will win the 2016 NCAA Division I Men's Basketball Championship?,"['North Carolina', 'Oklahoma', 'Syracuse', 'Villanova']",D,mc
148,Which team will win the 2015-2016 NBA Finals?,"['Cleveland Cavaliers', 'Another team from the Eastern Conference', 'Golden State Warriors', 'San Antonio Spurs', 'Another team from the Western Conference']",A,mc
149,Will an independent or third-party candidate win at least 5% of the popular vote in the U.S. presidential election?,"['Yes, but Donald Trump will not be that independent/third party candidate or be among them', 'No', 'Yes, and Donald Trump will be that independent/third party candidate or will be among them']",B,mc
150,Will the Department of Justice indict Hillary Clinton before 8 November 2016?,"['yes', 'no']",no,t/f
151,"Before 1 July 2016, will South Korea announce that the Terminal High-Altitude Area Defense (THAAD) missile defense system will be deployed on the Korean Peninsula?","['yes', 'no']",no,t/f
152,Will the European Union suspend any of Poland's membership rights in 2016?,"['yes', 'no']",no,t/f
153,Will Haiti hold run-off presidential elections as scheduled on 24 April 2016?,"['yes', 'no']",no,t/f
154,"Will ""Captain America: Civil War"" gross more in its opening weekend in the US than ""Batman vs. Superman: Dawn of Justice"" did?","['yes', 'no']",yes,t/f
155,Will Senator Ron Johnson (R-WI) be re-elected this November?,"['yes', 'no']",yes,t/f
156,Will Senator Rob Portman (R-OH) be re-elected this November?,"['yes', 'no']",yes,t/f
157,"Before 18 October 2016, will the US announce that it is opening a consulate or embassy in Iran?","['yes', 'no']",no,t/f
158,"Will a candidate included on the ""List of Hope"" or the ""People's Expert's List"" be elected as the next chairman of Iran's Assembly of Experts?","['yes', 'no']",no,t/f
159,How many worker protests will the China Labor Bulletin record from 1 May 2016 to 1 November 2016?,"['Between 1,200 and 2,000, inclusive', 'Between 3,000 and 5,000, inclusive', ' More than 5,000', 'Fewer than 1,200', 'More than 2,000 but less than 3,000']",D,mc
160,Will Jacob Zuma cease to be president of South Africa before 1 January 2017?,"['yes', 'no']",no,t/f
161,In 2016 will any of the G7 countries experience either inflation of 2% or more or GDP growth of 2.5% or more?,"['yes', 'no']",no,t/f
162,Will Toyota sell or lease more than 750 Mirai in the US in 2016?,"['yes', 'no']",yes,t/f
163,Will the 2016 industry-wide average cost of Li-on batteries used in battery-powered electric vehicles be less than $300 per kWh?,"['yes', 'no']",yes,t/f
164,"Will annual sales of electric vehicles in China reach 500,000 in 2016?","['yes', 'no']",yes,t/f
165,Will members of Sudan's military or paramilitary attempt to remove Omar al-Bashir as President of Sudan before 1 May 2017?,"['yes', 'no']",no,t/f
166,Will the Democratic Republic of the Congo hold presidential elections in 2016?,"['Yes, and Joseph Kabila Kabange will win', 'Yes, and Moise Katumbi Chapwe will win', 'Yes, but neither Kabila nor Katumbi will win', 'No']",D,mc
167,Will there be a new episode of mass killing in Bangladesh before 1 January 2017?,"['yes', 'no']",no,t/f
168,How many civilian fatalities will ACLED record in the Democratic Republic of the Congo between 1 May 2016 and 31 December 2016?,"['Fewer than 350', '350-750, inclusive', 'More than 750']",B,mc
169,"Before 2018, will it be officially announced that any state is withdrawing from the Schengen agreement?","['yes', 'no']",no,t/f
170,Will Afghanistan's parliamentary elections be held as scheduled on 15 October 2016?,"['yes', 'no']",no,t/f
171,Will the Deferred Action for Parents of Americans and Lawful Permanent Residents (DAPA) program be implemented prior to inauguration day?,"['yes', 'no']",no,t/f
